地域,支店名,住所,電話番号,都道府県名
大阪府,春木駅 ＡＴＭ,大阪府岸和田市春木若松町３１４番６号,,大阪府
大阪府,ウエルシアアクロスプラザ東岸和田店 ＡＴＭ,大阪府岸和田市土生町４-２-１,,大阪府
大阪府,千里中央支店,大阪府豊中市新千里東町１-２-１-２０１,06-6872-1001,大阪府
大阪府,豊中支店,大阪府豊中市本町１-６-７,06-6854-1221,大阪府
大阪府,豊中服部支店,大阪府豊中市服部本町１-７-１,06-6862-3031,大阪府
大阪府,大阪空港北ターミナルビル ＡＴＭ,大阪府豊中市螢池西町３-５５５,,大阪府
大阪府,大阪空港南ターミナルビル ＡＴＭ,大阪府豊中市蛍池西町３-５５５,,大阪府
大阪府,岡町駅前 ＡＴＭ,大阪府豊中市岡町１-２５,,大阪府
大阪府,大阪モノレール千里中央駅 ＡＴＭ,大阪府豊中市新千里東町１-５-４,,大阪府
大阪府,千里中央支店 ＡＴＭ,大阪府豊中市新千里東町１-２-１-２０１,06-6872-1001,大阪府
大阪府,豊中支店 ＡＴＭ,大阪府豊中市本町１-６-７,06-6854-1221,大阪府
大阪府,豊中服部支店 ＡＴＭ,大阪府豊中市服部本町１-７-１,06-6862-3031,大阪府
大阪府,パークヒルズ ＡＴＭ,大阪府豊中市上新田１-２８,,大阪府
大阪府,螢池駅前 ＡＴＭ,大阪府豊中市螢池東町１-６-２,,大阪府
大阪府,庄内駅前 ＡＴＭ,大阪府豊中市庄内東町２-１-１０,,大阪府
大阪府,池田合同庁舎 ＡＴＭ,大阪府池田市城南１-１-１,,大阪府
大阪府,江坂支店,大阪府吹田市豊津町１-３０-１０１,06-6380-0641,大阪府
大阪府,吹田支店,大阪府吹田市朝日町３-１１６,06-6381-1831,大阪府
大阪府,千里北支店,大阪府吹田市古江台４-２-Ｄ２-２０１,06-6872-0651,大阪府
大阪府,千里支店,大阪府吹田市津雲台１-１-２,06-6871-0191,大阪府
大阪府,アザール桃山台 ＡＴＭ,大阪府吹田市桃山台５-２-２,,大阪府
大阪府,亥の子谷 ＡＴＭ,大阪府吹田市山田西１-３１Ａ-１０１,,大阪府
大阪府,江坂支店 ＡＴＭ,大阪府吹田市豊津町１-３０-１０１,06-6380-0641,大阪府
大阪府,関大前 ＡＴＭ,大阪府吹田市千里山東１-１４-９,,大阪府
大阪府,吹田支店 ＡＴＭ,大阪府吹田市朝日町３-１１６,06-6381-1831,大阪府
大阪府,吹田市役所 ＡＴＭ,大阪府吹田市泉町１-３-４０,,大阪府
大阪府,千里北支店 ＡＴＭ,大阪府吹田市古江台４-２-Ｄ２-２０１,06-6872-0651,大阪府
大阪府,千里支店 ＡＴＭ,大阪府吹田市津雲台１-１-２,06-6871-0191,大阪府
大阪府,津雲台 ＡＴＭ,大阪府吹田市津雲台４-１-２３,,大阪府
大阪府,豊津駅前 ＡＴＭ,大阪府吹田市垂水町２-１-５,,大阪府
大阪府,山田 ＡＴＭ,大阪府吹田市山田西３-５７-１６,,大阪府
大阪府,トナリエ南千里 ＡＴＭ,大阪府吹田市津雲台１-１-３０,,大阪府
大阪府,平和堂岸辺店 ＡＴＭ,大阪府吹田市岸部南１-１３-１,,大阪府
大阪府,ららぽーとＥＸＰＯＣＩＴＹ ＡＴＭ,大阪府吹田市千里万博公園２-１　２階,,大阪府
大阪府,ＪＲ吹田駅東口 ＡＴＭ,大阪府吹田市朝日町１番１,,大阪府
大阪府,フレスコ千里丘店 ＡＴＭ,大阪府吹田市新芦屋上２３番１号,,大阪府
大阪府,ビエラ岸辺健都 ＡＴＭ,大阪府吹田市岸部新町５番４５号　２階,,大阪府
大阪府,泉大津支店,大阪府泉大津市旭町２０-３,0725-33-4021,大阪府
大阪府,泉大津支店 ＡＴＭ,大阪府泉大津市旭町２０-３,0725-33-4021,大阪府
大阪府,泉大津市役所 ＡＴＭ,大阪府泉大津市東雲町９-１２,,大阪府
大阪府,高槻支店,大阪府高槻市城北町２-１-１８,072-675-1201,大阪府
大阪府,高槻富田支店,大阪府高槻市富田町１-６-１１,072-693-6711,大阪府
大阪府,イオン高槻 ＡＴＭ,大阪府高槻市萩之庄３-４７-２,,大阪府
大阪府,高槻支店 ＡＴＭ,大阪府高槻市城北町２-１-１８,072-675-1201,大阪府
大阪府,高槻富田支店 ＡＴＭ,大阪府高槻市富田町１-６-１１,072-693-6711,大阪府
大阪府,摂津富田駅前 ＡＴＭ,大阪府高槻市富田町１-８-２５,,大阪府
大阪府,貝塚支店,大阪府貝塚市近木町４-１,072-431-1601,大阪府
大阪府,貝塚支店 ＡＴＭ,大阪府貝塚市近木町４-１,072-431-1601,大阪府
大阪府,守口支店,大阪府守口市京阪本通１-３-２,06-6993-0021,大阪府
大阪府,京阪守口市駅 ＡＴＭ,大阪府守口市河原町１-１,,大阪府
大阪府,大日 ＡＴＭ,大阪府守口市八雲東町２-８２-１８,,大阪府
大阪府,松下記念病院 ＡＴＭ,大阪府守口市外島町２-３５,,大阪府
大阪府,守口支店 ＡＴＭ,大阪府守口市京阪本通１-３-２,06-6993-0021,大阪府
大阪府,守口市役所 ＡＴＭ,大阪府守口市京阪本通２-５-５,,大阪府
大阪府,土居駅前 ＡＴＭ,大阪府守口市梅園町２-１,,大阪府
大阪府,イオンモール大日 ＡＴＭ,大阪府守口市大日東町１-１８,,大阪府
大阪府,くずは支店,大阪府枚方市楠葉花園町１２-５,072-855-2811,大阪府
大阪府,香里支店,大阪府枚方市香里ケ丘３-１３,072-854-0325,大阪府
大阪府,枚方支店,大阪府枚方市岡東町１２-２枚方Ｔ-ＳＩＴＥ　７階・１階・３階,072-846-2221,大阪府
大阪府,交野出張所,大阪府枚方市岡東町１２-２枚方Ｔ-ＳＩＴＥ　７階・１階・３階枚方支店内,072-846-2221,大阪府
大阪府,くずは支店 ＡＴＭ,大阪府枚方市楠葉花園町１２-５,072-855-2811,大阪府
大阪府,香里支店 ＡＴＭ,大阪府枚方市香里ケ丘３-１３,072-854-0325,大阪府
大阪府,枚方公園駅前 ＡＴＭ,大阪府枚方市枚方元町８-２１,,大阪府
大阪府,枚方支店 ＡＴＭ,大阪府枚方市岡東町１２-２枚方Ｔ-ＳＩＴＥ　７階・１階・３階,072-846-2221,大阪府
大阪府,枚方市役所別館 ＡＴＭ,大阪府枚方市大垣内町２-１-２０,,大阪府
大阪府,牧野駅前 ＡＴＭ,大阪府枚方市牧野阪２-５-２０-１０１,,大阪府
大阪府,くずはモール ＡＴＭ,大阪府枚方市楠葉花園町１５-１,,大阪府
大阪府,交野出張所 ＡＴＭ,大阪府枚方市岡東町１２-２枚方Ｔ-ＳＩＴＥ　７階・１階・３階枚方支店内,072-846-2221,大阪府
大阪府,茨木支店,大阪府茨木市永代町７-１,072-624-1121,大阪府
大阪府,茨木西支店,大阪府茨木市西駅前町６-２６,072-625-1551,大阪府
大阪府,茨木支店 ＡＴＭ,大阪府茨木市永代町７-１,072-624-1121,大阪府
大阪府,茨木市役所 ＡＴＭ,大阪府茨木市駅前３-８-１３,,大阪府
大阪府,茨木西支店 ＡＴＭ,大阪府茨木市西駅前町６-２６,072-625-1551,大阪府
大阪府,市場 ＡＴＭ,大阪府茨木市宮島１-１-１,,大阪府
大阪府,イオン新茨木店 ＡＴＭ,大阪府茨木市中津町１８-１,,大阪府
大阪府,平和堂真砂店 ＡＴＭ,大阪府茨木市真砂１-１１-３５,,大阪府
大阪府,南茨木 ＡＴＭ,大阪府茨木市沢良宜西１-４-５,,大阪府
大阪府,彩都 ＡＴＭ,大阪府茨木市彩都あさぎ７-１,,大阪府
大阪府,八尾支店,大阪府八尾市光町２-１３,072-997-5211,大阪府
大阪府,ＪＲ八尾駅前 ＡＴＭ,大阪府八尾市安中町３-７-６,,大阪府
大阪府,八尾支店 ＡＴＭ,大阪府八尾市光町２-１３,072-997-5211,大阪府
大阪府,八尾市役所 ＡＴＭ,大阪府八尾市本町１-１-１,,大阪府
大阪府,八尾市立病院 ＡＴＭ,大阪府八尾市龍華町１-３-１,,大阪府
大阪府,佐野支店,大阪府泉佐野市若宮町５-２１,072-462-3301,大阪府
大阪府,佐野支店 ＡＴＭ,大阪府泉佐野市若宮町５-２１,072-462-3301,大阪府
大阪府,りんくうタウン駅 ＡＴＭ,大阪府泉佐野市りんくう往来北１番,,大阪府
大阪府,富田林支店,大阪府富田林市本町１８-２４,0721-24-1281,大阪府
大阪府,喜志駅前 ＡＴＭ,大阪府富田林市喜志町３-４-３３,,大阪府
大阪府,富田林支店 ＡＴＭ,大阪府富田林市本町１８-２４,0721-24-1281,大阪府
大阪府,富田林市役所 ＡＴＭ,大阪府富田林市常盤町１-１,,大阪府
大阪府,寝屋川支店,大阪府寝屋川市桜木町１-３,072-826-3301,大阪府
大阪府,みいが丘出張所,大阪府寝屋川市桜木町１-３寝屋川支店内,072-826-1666,大阪府
大阪府,萱島駅前 ＡＴＭ,大阪府寝屋川市萱島本町５-１４,,大阪府
大阪府,香里園駅 ＡＴＭ,大阪府寝屋川市香里南之町１９-１,,大阪府
大阪府,万代寝屋川西店前 ＡＴＭ,大阪府寝屋川市対馬江東町１１-８,,大阪府
大阪府,寝屋川支店 ＡＴＭ,大阪府寝屋川市桜木町１-３,072-826-3301,大阪府
大阪府,寝屋川市役所 ＡＴＭ,大阪府寝屋川市本町１-１,,大阪府
大阪府,寝屋川東 ＡＴＭ,大阪府寝屋川市三井が丘４-１２-６,,大阪府
大阪府,河内千代田支店,大阪府河内長野市楠町東１５８７-４,0721-54-1201,大阪府
大阪府,イズミヤ河内長野店 ＡＴＭ,大阪府河内長野市喜多町６６３,,大阪府
大阪府,河内千代田支店 ＡＴＭ,大阪府河内長野市楠町東１５８７-４,0721-54-1201,大阪府
大阪府,ノバティながの北館 ＡＴＭ,大阪府河内長野市本町２４番１号地下１階,,大阪府
大阪府,天美出張所,大阪府松原市天美東７-８-４,072-333-2929,大阪府
大阪府,河内松原支店,大阪府松原市上田２-２-２０,072-330-6435,大阪府
大阪府,天美出張所 ＡＴＭ,大阪府松原市天美東７-８-４,072-333-2929,大阪府
大阪府,河内松原支店 ＡＴＭ,大阪府松原市上田２-２-２０,072-330-6435,大阪府
大阪府,住道支店,大阪府大東市赤井１-３-１４,072-874-1221,大阪府
大阪府,四條畷支店,大阪府大東市学園町３-６,072-876-0721,大阪府
大阪府,住道支店 ＡＴＭ,大阪府大東市赤井１-３-１４,072-874-1221,大阪府
大阪府,大東市役所 ＡＴＭ,大阪府大東市谷川１-１-１,,大阪府
大阪府,野崎 ＡＴＭ,大阪府大東市野崎１-６-２６,,大阪府
大阪府,四條畷支店 ＡＴＭ,大阪府大東市学園町３-６,072-876-0721,大阪府
大阪府,住道駅中央 ＡＴＭ,大阪府大東市住道２-３-１,,大阪府
大阪府,住道駅 ＡＴＭ,大阪府大東市住道２-３-１,,大阪府
大阪府,和泉中央支店,大阪府和泉市いぶき野５-１-１４,0725-57-4071,大阪府
大阪府,アムゼモール和泉中央 ＡＴＭ,大阪府和泉市いぶき野５-１-１２,,大阪府
大阪府,和泉中央支店 ＡＴＭ,大阪府和泉市いぶき野５-１-１４,0725-57-4071,大阪府
大阪府,ららぽーと和泉 ＡＴＭ,大阪府和泉市あゆみ野４-４-７　２階,,大阪府
大阪府,イオン和泉府中店 ＡＴＭ,大阪府和泉市肥子町２-２-１　１階,,大阪府
大阪府,箕面支店,大阪府箕面市箕面６-４-３３,072-721-7881,大阪府
大阪府,小野原 ＡＴＭ,大阪府箕面市小野原東５-１-１,,大阪府
大阪府,桜井 ＡＴＭ,大阪府箕面市桜井１-１３-２２,,大阪府
大阪府,箕面支店 ＡＴＭ,大阪府箕面市箕面６-４-３３,072-721-7881,大阪府
大阪府,箕面船場 ＡＴＭ,大阪府箕面市船場西２-７-５,,大阪府
大阪府,箕面市役所前 ＡＴＭ,大阪府箕面市西小路３-１-９,,大阪府
大阪府,みのおキューズモール ＡＴＭ,大阪府箕面市西宿１-１５-３０　１階,,大阪府
大阪府,柏原支店,大阪府柏原市上市１-２-２,072-972-1345,大阪府
大阪府,国分出張所,大阪府柏原市国分西１-２-２６,072-977-2205,大阪府
大阪府,柏原支店 ＡＴＭ,大阪府柏原市上市１-２-２,072-972-1345,大阪府
大阪府,柏原市役所 ＡＴＭ,大阪府柏原市安堂町１-５５,,大阪府
大阪府,国分出張所 ＡＴＭ,大阪府柏原市国分西１-２-２６,072-977-2205,大阪府
大阪府,羽曳野支店,大阪府羽曳野市白鳥２-１-１,072-957-1121,大阪府
大阪府,近鉄プラザ古市店 ＡＴＭ,大阪府羽曳野市栄町７-１,,大阪府
大阪府,羽曳野支店 ＡＴＭ,大阪府羽曳野市白鳥２-１-１,072-957-1121,大阪府
大阪府,羽曳野市役所 ＡＴＭ,大阪府羽曳野市誉田４-１-１,,大阪府
大阪府,ＬＩＣはびきの ＡＴＭ,大阪府羽曳野市軽里１-１４４,,大阪府
大阪府,門真市駅前 ＡＴＭ,大阪府門真市新橋町６-２３,,大阪府
大阪府,千里丘支店,大阪府摂津市千里丘東２-１０-１,072-622-7788,大阪府
大阪府,摂津市役所 ＡＴＭ,大阪府摂津市三島１-１-１,,大阪府
大阪府,千里丘支店 ＡＴＭ,大阪府摂津市千里丘東２-１０-１,072-622-7788,大阪府
大阪府,イオンモール藤井寺前 ＡＴＭ,大阪府藤井寺市岡２-１-３０,,大阪府
大阪府,小阪支店,大阪府東大阪市小阪本町１-４-３,06-6722-2490,大阪府
大阪府,長瀬支店,大阪府東大阪市菱屋西１-１８-２,06-6723-3031,大阪府
大阪府,東大阪支店,大阪府東大阪市荒本西１-４-２１,06-6788-2431,大阪府
大阪府,瓢箪山支店,大阪府東大阪市六万寺町３-１１-３５　関西みらい銀行枚岡支店内,072-988-6871,大阪府
大阪府,荒本駅前 ＡＴＭ,大阪府東大阪市荒本北６-１,,大阪府
大阪府,小阪支店 ＡＴＭ,大阪府東大阪市小阪本町１-４-３,06-6722-2490,大阪府
大阪府,新石切駅前 ＡＴＭ,大阪府東大阪市東山町４-８,,大阪府
大阪府,長瀬支店 ＡＴＭ,大阪府東大阪市菱屋西１-１８-２,06-6723-3031,大阪府
大阪府,東大阪支店 ＡＴＭ,大阪府東大阪市荒本西１-４-２１,06-6788-2431,大阪府
大阪府,東大阪市役所 ＡＴＭ,大阪府東大阪市荒本北１-１-１,,大阪府
大阪府,東花園駅前 ＡＴＭ,大阪府東大阪市吉田６-９-１３近商ストア新東花園店内,,大阪府
大阪府,瓢箪山支店 ＡＴＭ,大阪府東大阪市六万寺町３-１１-３５　関西みらい銀行枚岡支店内,072-988-6871,大阪府
大阪府,布施駅前 ＡＴＭ,大阪府東大阪市長堂１-１-１０,,大阪府
大阪府,近鉄八戸ノ里駅 ＡＴＭ,大阪府東大阪市小阪３-１-１,,大阪府
大阪府,近商ストア若江岩田店 ＡＴＭ,大阪府東大阪市岩田町４-３-２１,,大阪府
大阪府,瓢箪山駅前 ＡＴＭ,大阪府東大阪市本町１５番１１号,,大阪府
大阪府,四條畷市役所 ＡＴＭ,大阪府四條畷市中野本町１-１,,大阪府
大阪府,四條畷西 ＡＴＭ,大阪府四條畷市楠公１-１３-９,,大阪府
大阪府,コモンシティ星田 ＡＴＭ,大阪府交野市星田西３-３-１,,大阪府
大阪府,星田駅 ＡＴＭ,大阪府交野市星田５-１１-５,,大阪府
大阪府,交野駅前 ＡＴＭ,大阪府交野市私部西１-６-１０,,大阪府
大阪府,交野駅前東 ＡＴＭ,大阪府交野市私部３-１２-６関西みらい銀行交野支店・交野郡津出張所内,,大阪府
大阪府,金剛支店,大阪府大阪狭山市金剛１-１-１９,072-365-3355,大阪府
大阪府,大阪狭山市役所 ＡＴＭ,大阪府大阪狭山市狭山１-２３８４-１,,大阪府
大阪府,近畿大学病院 ＡＴＭ,大阪府大阪狭山市大野東３７７-２,,大阪府
大阪府,金剛支店 ＡＴＭ,大阪府大阪狭山市金剛１-１-１９,072-365-3355,大阪府
大阪府,島本支店,大阪府三島郡島本町江川２-１３-３,075-961-5331,大阪府
大阪府,島本支店 ＡＴＭ,大阪府三島郡島本町江川２-１３-３,075-961-5331,大阪府
大阪府,熊取支店,大阪府泉南郡熊取町大久保中１-１７-３,072-452-2761,大阪府
大阪府,熊取支店 ＡＴＭ,大阪府泉南郡熊取町大久保中１-１７-３,072-452-2761,大阪府
大阪府,関空ターミナルビル ＡＴＭ,大阪府泉南郡田尻町泉州空港中１番地４階,,大阪府
大阪府,関空第二ターミナル ＡＴＭ,大阪府泉南郡田尻町泉州空港中１３番地,,大阪府
大阪府,河南町役場 ＡＴＭ,大阪府南河内郡河南町大字白木１３５９-６,,大阪府
兵庫県,神戸岡本支店,兵庫県神戸市東灘区岡本１-４-２３,078-441-2002,兵庫県
兵庫県,神戸岡本支店 ＡＴＭ,兵庫県神戸市東灘区岡本１-４-２３,078-441-2002,兵庫県
兵庫県,六甲ライナー住吉駅 ＡＴＭ,兵庫県神戸市東灘区住吉本町１-２,,兵庫県
兵庫県,六甲ライナー魚崎駅 ＡＴＭ,兵庫県神戸市東灘区魚崎西町４丁目,,兵庫県
兵庫県,灘 ＡＴＭ,兵庫県神戸市灘区備後町３-２-１６,,兵庫県
兵庫県,西神戸支店,兵庫県神戸市兵庫区大開通１-１-１４,078-577-2551,兵庫県
兵庫県,西神戸支店 ＡＴＭ,兵庫県神戸市兵庫区大開通１-１-１４,078-577-2551,兵庫県
兵庫県,長田 ＡＴＭ,兵庫県神戸市長田区腕塚町６-１-３１-１０２,,兵庫県
兵庫県,須磨 ＡＴＭ,兵庫県神戸市須磨区須磨浦通４-５-１６,,兵庫県
兵庫県,垂水支店,兵庫県神戸市垂水区天ノ下町１-１-１０５,078-706-5671,兵庫県
兵庫県,垂水支店 ＡＴＭ,兵庫県神戸市垂水区天ノ下町１-１-１０５,078-706-5671,兵庫県
兵庫県,北鈴蘭台支店,兵庫県神戸市北区甲栄台１-１-１,078-593-1181,兵庫県
兵庫県,押部谷出張所,兵庫県神戸市北区甲栄台一丁目１番１号北鈴蘭台支店内,078-593-1821,兵庫県
兵庫県,大池駅前 ＡＴＭ,兵庫県神戸市北区山田町上谷上字古々山２９-８４,,兵庫県
兵庫県,北鈴蘭台支店 ＡＴＭ,兵庫県神戸市北区甲栄台１-１-１,078-593-1181,兵庫県
兵庫県,イオンつくしが丘店 ＡＴＭ,兵庫県神戸市北区筑紫が丘３-２-１０,,兵庫県
兵庫県,押部谷出張所 ＡＴＭ,兵庫県神戸市北区甲栄台一丁目１番１号北鈴蘭台支店内,078-593-1821,兵庫県
兵庫県,神戸支店,兵庫県神戸市中央区小野柄通７-１-１８,078-272-0901,兵庫県
兵庫県,神戸支店 ＡＴＭ,兵庫県神戸市中央区小野柄通７-１-１８,078-272-0901,兵庫県
兵庫県,三宮・花時計前駅西 ＡＴＭ,兵庫県神戸市中央区三宮町１-３-１１,,兵庫県
兵庫県,ポートライナー三宮駅 ＡＴＭ,兵庫県神戸市中央区雲井通８丁目,,兵庫県
兵庫県,三宮センター街 ＡＴＭ,兵庫県神戸市中央区三宮町一丁目９番１号１１０　１階,,兵庫県
兵庫県,ポートライナー神戸空港駅 ＡＴＭ,兵庫県神戸市中央区神戸空港１番,,兵庫県
兵庫県,姫路支店,兵庫県姫路市白銀町１,079-222-7191,兵庫県
兵庫県,姫路支店 ＡＴＭ,兵庫県姫路市白銀町１,079-222-7191,兵庫県
兵庫県,尼崎北支店,兵庫県尼崎市潮江１-１５-３,06-6499-3545,兵庫県
兵庫県,尼崎支店,兵庫県尼崎市昭和通７-２３４,06-6413-0521,兵庫県
兵庫県,塚口支店,兵庫県尼崎市南塚口町２-１-２-１２８,06-6427-6851,兵庫県
兵庫県,尼崎北支店 ＡＴＭ,兵庫県尼崎市潮江１-１５-３,06-6499-3545,兵庫県
兵庫県,尼崎支店 ＡＴＭ,兵庫県尼崎市昭和通７-２３４,06-6413-0521,兵庫県
兵庫県,ＪＲ尼崎駅前 ＡＴＭ,兵庫県尼崎市潮江１-４-１,,兵庫県
兵庫県,立花 ＡＴＭ,兵庫県尼崎市七松町１-３-１-１２５,,兵庫県
兵庫県,塚口支店 ＡＴＭ,兵庫県尼崎市南塚口町２-１-２-１２８,06-6427-6851,兵庫県
兵庫県,ビエラ塚口 ＡＴＭ,兵庫県尼崎市上坂部１-１-１　１階,,兵庫県
兵庫県,明石支店,兵庫県明石市本町１-２-２６,078-911-8961,兵庫県
兵庫県,明石支店 ＡＴＭ,兵庫県明石市本町１-２-２６,078-911-8961,兵庫県
兵庫県,西宮北口支店,兵庫県西宮市甲風園１-８-１４,0798-64-0500,兵庫県
兵庫県,西宮支店,兵庫県西宮市田中町１番６号エビスタ西宮２階,0798-22-3781,兵庫県
兵庫県,ＪＲ甲子園口駅前 ＡＴＭ,兵庫県西宮市甲子園口３-４-１４,,兵庫県
兵庫県,西宮北口支店 ＡＴＭ,兵庫県西宮市甲風園１-８-１４,0798-64-0500,兵庫県
兵庫県,西宮支店 ＡＴＭ,兵庫県西宮市田中町１番６号エビスタ西宮２階,0798-22-3781,兵庫県
兵庫県,西宮マリナパークシティ ＡＴＭ,兵庫県西宮市西宮浜４-１４-２,,兵庫県
兵庫県,甲子園球場前 ＡＴＭ,兵庫県西宮市甲子園七番町１１-２０　１階,,兵庫県
兵庫県,西宮北口駅前 ＡＴＭ,兵庫県西宮市高松町３番３２号北口南阪急ビル２階西宮北口ローンプラザ内,,兵庫県
兵庫県,夙川駅前 ＡＴＭ,兵庫県西宮市相生町２番１号,,兵庫県
兵庫県,ＪＲ芦屋駅前 ＡＴＭ,兵庫県芦屋市業平町１-１９,,兵庫県
兵庫県,伊丹支店,兵庫県伊丹市中央１-６-１５,072-772-8265,兵庫県
兵庫県,イズミヤ昆陽店 ＡＴＭ,兵庫県伊丹市池尻１-１,,兵庫県
兵庫県,伊丹支店 ＡＴＭ,兵庫県伊丹市中央１-６-１５,072-772-8265,兵庫県
兵庫県,加古川支店,兵庫県加古川市加古川町溝之口７０１みなと銀行加古川支店２階,079-424-3101,兵庫県
兵庫県,加古川支店 ＡＴＭ,兵庫県加古川市加古川町溝之口７０１みなと銀行加古川支店２階,079-424-3101,兵庫県
兵庫県,仁川出張所,兵庫県宝塚市仁川北３-７-９,0798-53-2001,兵庫県
兵庫県,仁川出張所 ＡＴＭ,兵庫県宝塚市仁川北３-７-９,0798-53-2001,兵庫県
兵庫県,川西北支店,兵庫県川西市栄町２０-１ベルフローラ・かわにしＷＥＳＴ１階川西支店内,072-758-5191,兵庫県
兵庫県,川西支店,兵庫県川西市栄町２０番１号ベルフローラ・かわにしＷＥＳＴ１階,072-758-5971,兵庫県
兵庫県,川西北支店 ＡＴＭ,兵庫県川西市栄町２０-１ベルフローラ・かわにしＷＥＳＴ１階川西支店内,072-758-5191,兵庫県
兵庫県,川西支店 ＡＴＭ,兵庫県川西市栄町２０番１号ベルフローラ・かわにしＷＥＳＴ１階,072-758-5971,兵庫県
兵庫県,イズミヤ多田店 ＡＴＭ,兵庫県川西市多田桜木１-８-３,,兵庫県
兵庫県,三田支店,兵庫県三田市三輪１-７-１２,079-563-7371,兵庫県
兵庫県,イオン三田ウッディタウン店 ＡＴＭ,兵庫県三田市けやき台１-６-２,,兵庫県
兵庫県,三田支店 ＡＴＭ,兵庫県三田市三輪１-７-１２,079-563-7371,兵庫県
兵庫県,イオンモール猪名川 ＡＴＭ,兵庫県川辺郡猪名川町白金２-１,,兵庫県
奈良県,近鉄学園前支店,奈良県奈良市学園北１-９-１,0742-45-9601,奈良県
奈良県,近鉄西大寺支店,奈良県奈良市西大寺東町２-１-３１,0742-33-3161,奈良県
奈良県,学園大和町支店,奈良県奈良市学園北１-９-１パラディ２内近鉄学園前支店内,0742-46-4855,奈良県
奈良県,新奈良営業部,奈良県奈良市三条本町１-２,0742-23-3344,奈良県
奈良県,近鉄学園前支店 ＡＴＭ,奈良県奈良市学園北１-９-１,0742-45-9601,奈良県
奈良県,近鉄西大寺支店 ＡＴＭ,奈良県奈良市西大寺東町２-１-３１,0742-33-3161,奈良県
奈良県,高の原駅前 ＡＴＭ,奈良県奈良市右京１-３-４,,奈良県
奈良県,学園大和町支店 ＡＴＭ,奈良県奈良市学園北１-９-１パラディ２内近鉄学園前支店内,0742-46-4855,奈良県
奈良県,近鉄奈良駅 ＡＴＭ,奈良県奈良市東向中町２８　１階,,奈良県
奈良県,新奈良営業部 ＡＴＭ,奈良県奈良市三条本町１-２,0742-23-3344,奈良県
奈良県,近鉄新大宮駅 ＡＴＭ,奈良県奈良市芝辻町４-１５-５,,奈良県
奈良県,近鉄菖蒲池 ＡＴＭ,奈良県奈良市あやめ池南２-２-１,,奈良県
奈良県,近鉄富雄駅 ＡＴＭ,奈良県奈良市富雄元町２-３-３５,,奈良県
奈良県,近鉄大和高田駅 ＡＴＭ,奈良県大和高田市北本町１４-４,,奈良県
奈良県,やまと郡山支店,奈良県大和郡山市高田町２-１,0743-53-8901,奈良県
奈良県,小泉支店,奈良県大和郡山市高田町２-１やまと郡山支店内,0743-53-4581,奈良県
奈良県,やまと郡山支店 ＡＴＭ,奈良県大和郡山市高田町２-１,0743-53-8901,奈良県
奈良県,小泉支店 ＡＴＭ,奈良県大和郡山市高田町２-１やまと郡山支店内,0743-53-4581,奈良県
奈良県,ラッキーやまと小泉店 ＡＴＭ,奈良県大和郡山市小泉町東１-８-３,,奈良県
奈良県,天理支店,奈良県天理市川原城町７９６,0743-62-1444,奈良県
奈良県,イオンタウン天理 ＡＴＭ,奈良県天理市東井戸堂町３８１,,奈良県
奈良県,天理支店 ＡＴＭ,奈良県天理市川原城町７９６,0743-62-1444,奈良県
奈良県,橿原支店,奈良県橿原市内膳町５-２-２９,0744-22-3501,奈良県
奈良県,橿原支店 ＡＴＭ,奈良県橿原市内膳町５-２-２９,0744-22-3501,奈良県
奈良県,橿原神宮前 ＡＴＭ,奈良県橿原市久米町６１８,,奈良県
奈良県,イオンモール橿原 ＡＴＭ,奈良県橿原市曲川町７-２０-１　１階,,奈良県
