地域,支店名,住所,電話番号,都道府県名
東京都,足立 ＡＴＭ,東京都足立区梅田７-３４-１３-１０２,,東京都
東京都,東武北千住駅改札内 ＡＴＭ,東京都足立区千住旭町４２-１,,東京都
東京都,千住支店 ＡＴＭ,東京都足立区千住２-５５,03-3882-5111,東京都
東京都,竹の塚五丁目 ＡＴＭ,東京都足立区竹の塚５-７-３,,東京都
東京都,竹ノ塚支店 ＡＴＭ,東京都足立区竹の塚１-３９-１４-１０２,03-3884-0611,東京都
東京都,西新井支店 ＡＴＭ,東京都足立区梅島２-３-１２,03-3887-7811,東京都
東京都,花畑団地 ＡＴＭ,東京都足立区花畑４-３９-１３,,東京都
東京都,西友竹の塚店 ＡＴＭ,東京都足立区西竹の塚１-１１-２,,東京都
東京都,青戸支店,東京都葛飾区青戸３-３２-１６,03-3602-5141,東京都
東京都,金町支店,東京都葛飾区金町２-２９-１０,03-3607-3101,東京都
東京都,堀切支店,東京都葛飾区堀切４-９-５,03-3697-2191,東京都
東京都,青戸支店 ＡＴＭ,東京都葛飾区青戸３-３２-１６,03-3602-5141,東京都
東京都,金町支店 ＡＴＭ,東京都葛飾区金町２-２９-１０,03-3607-3101,東京都
東京都,堀切支店 ＡＴＭ,東京都葛飾区堀切４-９-５,03-3697-2191,東京都
東京都,江戸川南支店,東京都江戸川区一之江６-１９-８,03-3654-3211,東京都
東京都,小岩支店,東京都江戸川区南小岩６-３１-１０,03-3657-1131,東京都
東京都,西葛西支店,東京都江戸川区西葛西５-５-１,03-3686-7511,東京都
東京都,江戸川南支店 ＡＴＭ,東京都江戸川区一之江６-１９-８,03-3654-3211,東京都
東京都,小岩支店 ＡＴＭ,東京都江戸川区南小岩６-３１-１０,03-3657-1131,東京都
東京都,篠崎駅前 ＡＴＭ,東京都江戸川区篠崎町７-２０-１９,,東京都
東京都,西葛西支店 ＡＴＭ,東京都江戸川区西葛西５-５-１,03-3686-7511,東京都
東京都,平井駅北口 ＡＴＭ,東京都江戸川区平井５-２１-１２,,東京都
東京都,東小松川 ＡＴＭ,東京都江戸川区松江１-７-８,,東京都
東京都,ファスタ小岩 ＡＴＭ,東京都江戸川区南小岩６-３１-１０,,東京都
東京都,八王子支店,東京都八王子市横山町１９-１,042-642-0211,東京都
東京都,八王子支店 ＡＴＭ,東京都八王子市横山町１９-１,042-642-0211,東京都
東京都,イトーヨーカドー八王子店 ＡＴＭ,東京都八王子市狭間町１４６２-１,,東京都
東京都,八王子駅前 ＡＴＭ,東京都八王子市旭町１-１,,東京都
東京都,立川支店,東京都立川市柴崎町３-６-２９,042-522-4161,東京都
東京都,立川駅南口サザン１階 ＡＴＭ,東京都立川市柴崎町３-２-１,,東京都
東京都,立川支店 ＡＴＭ,東京都立川市柴崎町３-６-２９,042-522-4161,東京都
東京都,ららぽーと立川立飛 ＡＴＭ,東京都立川市泉町９３５-１　１階,,東京都
東京都,立川駅北 ＡＴＭ,東京都立川市曙町２-１１-２フロム中武１階,,東京都
東京都,ヤオコー立川若葉町店 ＡＴＭ,東京都立川市若葉町１-１２-１,,東京都
東京都,吉祥寺支店,東京都武蔵野市吉祥寺本町１-８-１０,0422-22-3601,東京都
東京都,吉祥寺支店 ＡＴＭ,東京都武蔵野市吉祥寺本町１-８-１０,0422-22-3601,東京都
東京都,八幡町 ＡＴＭ,東京都武蔵野市八幡町３-５-９,,東京都
東京都,ヨドバシ吉祥寺 ＡＴＭ,東京都武蔵野市吉祥寺本町１-１９-１,,東京都
東京都,三鷹駅南口 ＡＴＭ,東京都三鷹市下連雀３-４６-１,,東京都
東京都,三鷹台 ＡＴＭ,東京都三鷹市牟礼３-１１-１,,東京都
東京都,河辺支店,東京都青梅市河辺町１０-２-９,0428-24-2401,東京都
東京都,東青梅支店,東京都青梅市東青梅２-１７-４,0428-22-2121,東京都
東京都,青梅 ＡＴＭ,東京都青梅市仲町２９５,,東京都
東京都,青梅市役所 ＡＴＭ,東京都青梅市東青梅１-１１-１,,東京都
東京都,河辺駅南口 ＡＴＭ,東京都青梅市河辺町５-９-２,,東京都
東京都,河辺支店 ＡＴＭ,東京都青梅市河辺町１０-２-９,0428-24-2401,東京都
東京都,バリュー新町店 ＡＴＭ,東京都青梅市新町２-３４-１,,東京都
東京都,東青梅駅北口 ＡＴＭ,東京都青梅市東青梅２-１４-４１,,東京都
東京都,東青梅支店 ＡＴＭ,東京都青梅市東青梅２-１７-４,0428-22-2121,東京都
東京都,東府中支店,東京都府中市若松町１-３-４,042-363-6111,東京都
東京都,府中中河原支店,東京都府中市住吉町４-１０-１１,042-366-3121,東京都
東京都,東府中支店 ＡＴＭ,東京都府中市若松町１-３-４,042-363-6111,東京都
東京都,府中中河原支店 ＡＴＭ,東京都府中市住吉町４-１０-１１,042-366-3121,東京都
東京都,府中駅前 ＡＴＭ,東京都府中市宮町１-１００ル・シーニュ２階,,東京都
東京都,昭島支店,東京都昭島市昭和町５-４-１５,042-545-1234,東京都
東京都,昭島支店 ＡＴＭ,東京都昭島市昭和町５-４-１５,042-545-1234,東京都
東京都,拝島駅 ＡＴＭ,東京都昭島市松原町４-１４-４,,東京都
東京都,調布支店,東京都調布市小島町１-１２-６,042-486-5151,東京都
東京都,調布支店 ＡＴＭ,東京都調布市小島町１-１２-６,042-486-5151,東京都
東京都,成瀬支店,東京都町田市南成瀬１-１-１,042-728-5211,東京都
東京都,町田中央支店,東京都町田市中町１-１-１６,042-720-7211,東京都
東京都,成瀬支店 ＡＴＭ,東京都町田市南成瀬１-１-１,042-728-5211,東京都
東京都,本町田 ＡＴＭ,東京都町田市藤の台一丁目１番５２-１０４,,東京都
東京都,町田中央支店 ＡＴＭ,東京都町田市中町１-１-１６,042-720-7211,東京都
東京都,ヨドバシカメラ町田駅前店 ＡＴＭ,東京都町田市原町田１-１-１１,,東京都
東京都,小田急町田駅南 ＡＴＭ,東京都町田市原町田６-１１-１４,,東京都
東京都,小平支店,東京都小平市学園東町１-４-３７,042-341-2511,東京都
東京都,花小金井支店,東京都小平市花小金井１-１-８,042-467-6611,東京都
東京都,小平駅前 ＡＴＭ,東京都小平市美園町１-３３-１,,東京都
東京都,小平支店 ＡＴＭ,東京都小平市学園東町１-４-３７,042-341-2511,東京都
東京都,小平市役所 ＡＴＭ,東京都小平市小川町２-１３３３,,東京都
東京都,小平東 ＡＴＭ,東京都小平市喜平町３-２-３２,,東京都
東京都,新小平駅前 ＡＴＭ,東京都小平市小川町２-１９５９-３,,東京都
東京都,花小金井駅南口 ＡＴＭ,東京都小平市花小金井１-１０-５,,東京都
東京都,花小金井支店 ＡＴＭ,東京都小平市花小金井１-１-８,042-467-6611,東京都
東京都,豊田駅北口 ＡＴＭ,東京都日野市多摩平１-１ファミーユ京王１階,,東京都
東京都,久米川支店,東京都東村山市栄町２-８-２０,042-393-2111,東京都
東京都,東村山支店,東京都東村山市野口町１-３-１,042-393-1101,東京都
東京都,久米川支店 ＡＴＭ,東京都東村山市栄町２-８-２０,042-393-2111,東京都
東京都,新秋津駅前 ＡＴＭ,東京都東村山市秋津町５-１３-９２,,東京都
東京都,東村山支店 ＡＴＭ,東京都東村山市野口町１-３-１,042-393-1101,東京都
東京都,東村山市役所 ＡＴＭ,東京都東村山市本町１-２-３,,東京都
東京都,本町 ＡＴＭ,東京都東村山市本町２-２０-９３,,東京都
東京都,国立支店,東京都国立市中１-９-３０国立せきやビル４階,042-572-8181,東京都
東京都,国立支店 ＡＴＭ,東京都国立市中１-９-３０国立せきやビル４階,042-572-8181,東京都
東京都,国立せきやビル１階 ＡＴＭ,東京都国立市中１-９-３０,,東京都
東京都,国立せきやビル４階 ＡＴＭ,東京都国立市中１-９-３０,,東京都
東京都,福生支店,東京都福生市福生１０４８,042-551-1021,東京都
東京都,福生支店 ＡＴＭ,東京都福生市福生１０４８,042-551-1021,東京都
東京都,いなげや狛江東野川店 ＡＴＭ,東京都狛江市東野川３-１-６,,東京都
東京都,東大和支店,東京都東大和市中央３-８５３-２,042-565-5311,東京都
東京都,東大和市駅前 ＡＴＭ,東京都東大和市桜が丘１-１３３０-１９,,東京都
東京都,東大和支店 ＡＴＭ,東京都東大和市中央３-８５３-２,042-565-5311,東京都
東京都,東大和市役所 ＡＴＭ,東京都東大和市中央３-９３０,,東京都
東京都,清瀬支店,東京都清瀬市元町１-２-１１,042-491-3515,東京都
東京都,いなげや秋津駅前店 ＡＴＭ,東京都清瀬市野塩１-３３７-１,,東京都
東京都,清瀬支店 ＡＴＭ,東京都清瀬市元町１-２-１１,042-491-3515,東京都
東京都,清瀬市役所 ＡＴＭ,東京都清瀬市中里５-８４２,,東京都
東京都,東久留米支店,東京都東久留米市本町１-４-１,042-471-3201,東京都
東京都,東久留米滝山支店,東京都東久留米市滝山４-１-２６,042-471-7611,東京都
東京都,イトーヨーカドー東久留米店 ＡＴＭ,東京都東久留米市本町３-８-１,,東京都
東京都,東久留米駅東口 ＡＴＭ,東京都東久留米市東本町１-８,,東京都
東京都,東久留米支店 ＡＴＭ,東京都東久留米市本町１-４-１,042-471-3201,東京都
東京都,東久留米滝山支店 ＡＴＭ,東京都東久留米市滝山４-１-２６,042-471-7611,東京都
東京都,東久留米団地 ＡＴＭ,東京都東久留米市神宝町２-１１-１６,,東京都
東京都,イオンモール東久留米 ＡＴＭ,東京都東久留米市南沢５-１７-６２　１階,,東京都
東京都,村山支店,東京都武蔵村山市本町４-８-３,042-561-1211,東京都
東京都,武蔵村山市役所 ＡＴＭ,東京都武蔵村山市本町１-１-１,,東京都
東京都,村山支店 ＡＴＭ,東京都武蔵村山市本町４-８-３,042-561-1211,東京都
東京都,イオンモールむさし村山 ＡＴＭ,東京都武蔵村山市榎１-１-３,,東京都
東京都,イオンモールむさし村山サウスコート ＡＴＭ,東京都武蔵村山市榎１-１-３,,東京都
東京都,小作駅前 ＡＴＭ,東京都羽村市小作台１-２-１５,,東京都
東京都,羽村 ＡＴＭ,東京都羽村市五ノ神４-１３-１０,,東京都
東京都,あきる野支店,東京都あきる野市秋川２-１８-３,042-558-2611,東京都
東京都,五日市出張所,東京都あきる野市五日市８４０-１,042-596-1311,東京都
東京都,あきる野支店 ＡＴＭ,東京都あきる野市秋川２-１８-３,042-558-2611,東京都
東京都,あきる野市役所 ＡＴＭ,東京都あきる野市二宮３５０,,東京都
東京都,五日市出張所 ＡＴＭ,東京都あきる野市五日市８４０-１,042-596-1311,東京都
東京都,公立阿伎留医療センター ＡＴＭ,東京都あきる野市引田７８-１,,東京都
東京都,田無支店,東京都西東京市田無町４-１-２,042-461-1411,東京都
東京都,ひばりヶ丘支店,東京都西東京市谷戸町３-２７-２０,042-422-5111,東京都
東京都,田無支店 ＡＴＭ,東京都西東京市田無町４-１-２,042-461-1411,東京都
東京都,ひばりヶ丘駅北口 ＡＴＭ,東京都西東京市ひばりが丘北３-３-１４,,東京都
東京都,ひばりヶ丘支店 ＡＴＭ,東京都西東京市谷戸町３-２７-２０,042-422-5111,東京都
東京都,日の出町役場 ＡＴＭ,東京都西多摩郡日の出町大字平井２７８０,,東京都
神奈川県,鶴見支店,神奈川県横浜市鶴見区鶴見中央４-２７-１,045-503-2211,神奈川県
神奈川県,鶴見駅西口 ＡＴＭ,神奈川県横浜市鶴見区豊岡町３-２７,,神奈川県
神奈川県,鶴見支店 ＡＴＭ,神奈川県横浜市鶴見区鶴見中央４-２７-１,045-503-2211,神奈川県
神奈川県,矢向駅 ＡＴＭ,神奈川県横浜市鶴見区矢向６-５-６,,神奈川県
神奈川県,大口通商店街 ＡＴＭ,神奈川県横浜市神奈川区大口通３５-７,,神奈川県
神奈川県,子安駅前 ＡＴＭ,神奈川県横浜市神奈川区子安通１-５-６,,神奈川県
神奈川県,戸部出張所,神奈川県横浜市西区浜松町１-１８,045-231-3131,神奈川県
神奈川県,横浜西口支店,神奈川県横浜市西区北幸１-１１-７,045-323-6511,神奈川県
神奈川県,戸部出張所 ＡＴＭ,神奈川県横浜市西区浜松町１-１８,045-231-3131,神奈川県
神奈川県,横浜西口支店 ＡＴＭ,神奈川県横浜市西区北幸１-１１-７,045-323-6511,神奈川県
神奈川県,横浜駅西口地下街第１ ＡＴＭ,神奈川県横浜市西区南幸１-４-Ｂ１,,神奈川県
神奈川県,横浜駅西口地下街第２ ＡＴＭ,神奈川県横浜市西区南幸１-４-Ｂ１,,神奈川県
神奈川県,横浜支店,神奈川県横浜市中区常盤町４-５４,045-661-1111,神奈川県
神奈川県,日本大通 ＡＴＭ,神奈川県横浜市中区日本大通１７,,神奈川県
神奈川県,横浜支店 ＡＴＭ,神奈川県横浜市中区常盤町４-５４,045-661-1111,神奈川県
神奈川県,弘明寺支店,神奈川県横浜市南区通町２-３５,045-731-5741,神奈川県
神奈川県,井土ヶ谷 ＡＴＭ,神奈川県横浜市南区井土ヶ谷中町１６１-６,,神奈川県
神奈川県,弘明寺支店 ＡＴＭ,神奈川県横浜市南区通町２-３５,045-731-5741,神奈川県
神奈川県,保土ケ谷駅ビル ＡＴＭ,神奈川県横浜市保土ケ谷区岩井町１-７,,神奈川県
神奈川県,クスリのカツマタ和田町店 ＡＴＭ,神奈川県横浜市保土ケ谷区星川３丁目８-１,,神奈川県
神奈川県,磯子支店,神奈川県横浜市磯子区中浜町１４-１６,045-751-3141,神奈川県
神奈川県,磯子支店 ＡＴＭ,神奈川県横浜市磯子区中浜町１４-１６,045-751-3141,神奈川県
神奈川県,根岸駅前 ＡＴＭ,神奈川県横浜市磯子区東町１７-３０,,神奈川県
神奈川県,金沢文庫出張所,神奈川県横浜市金沢区泥亀２-１３-１,045-701-1331,神奈川県
神奈川県,金沢文庫駅前 ＡＴＭ,神奈川県横浜市金沢区谷津町３８０-３,,神奈川県
神奈川県,金沢文庫出張所 ＡＴＭ,神奈川県横浜市金沢区泥亀２-１３-１,045-701-1331,神奈川県
神奈川県,新横浜支店,神奈川県横浜市港北区新横浜３-８-１２,045-475-2561,神奈川県
神奈川県,綱島支店,神奈川県横浜市港北区綱島西１-７-４,045-541-5411,神奈川県
神奈川県,妙蓮寺出張所,神奈川県横浜市港北区菊名１-７-２３,045-433-1221,神奈川県
神奈川県,大倉山駅前 ＡＴＭ,神奈川県横浜市港北区大倉山３-１-８,,神奈川県
神奈川県,菊名駅前 ＡＴＭ,神奈川県横浜市港北区菊名６-１-４,,神奈川県
神奈川県,新横浜支店 ＡＴＭ,神奈川県横浜市港北区新横浜３-８-１２,045-475-2561,神奈川県
神奈川県,綱島支店 ＡＴＭ,神奈川県横浜市港北区綱島西１-７-４,045-541-5411,神奈川県
神奈川県,妙蓮寺出張所 ＡＴＭ,神奈川県横浜市港北区菊名１-７-２３,045-433-1221,神奈川県
神奈川県,日吉駅西口 ＡＴＭ,神奈川県横浜市港北区日吉２-２-１８,,神奈川県
神奈川県,新横浜駅 ＡＴＭ,神奈川県横浜市港北区新横浜２-１００-４５キュービックプラザ新横浜１階,,神奈川県
神奈川県,戸塚支店,神奈川県横浜市戸塚区戸塚町１６-１,045-871-4041,神奈川県
神奈川県,戸塚支店 ＡＴＭ,神奈川県横浜市戸塚区戸塚町１６-１,045-871-4041,神奈川県
神奈川県,トツカーナ ＡＴＭ,神奈川県横浜市戸塚区戸塚町１６-１,,神奈川県
神奈川県,上大岡支店,神奈川県横浜市港南区上大岡西１-１４-６,045-842-3641,神奈川県
神奈川県,上大岡支店 ＡＴＭ,神奈川県横浜市港南区上大岡西１-１４-６,045-842-3641,神奈川県
神奈川県,ドン・キホーテ二俣川店 ＡＴＭ,神奈川県横浜市旭区二俣川１-４３-２８,,神奈川県
神奈川県,そうてつローゼン南まきが原店 ＡＴＭ,神奈川県横浜市旭区柏町１３０-１,,神奈川県
神奈川県,中山 ＡＴＭ,神奈川県横浜市緑区中山一丁目２７番６号,,神奈川県
神奈川県,三ッ境支店,神奈川県横浜市瀬谷区三ツ境１０５-５,045-362-5111,神奈川県
神奈川県,三ッ境支店 ＡＴＭ,神奈川県横浜市瀬谷区三ツ境１０５-５,045-362-5111,神奈川県
神奈川県,本郷台駅前 ＡＴＭ,神奈川県横浜市栄区小菅ヶ谷１-４-７,,神奈川県
神奈川県,たまプラーザ支店,神奈川県横浜市青葉区美しが丘１-９-１７,045-901-7311,神奈川県
神奈川県,たまプラーザ支店 ＡＴＭ,神奈川県横浜市青葉区美しが丘１-９-１７,045-901-7311,神奈川県
神奈川県,青葉台 ＡＴＭ,神奈川県横浜市青葉区青葉台２-８-２０,,神奈川県
神奈川県,港北ニュータウン支店,神奈川県横浜市都筑区中川中央１-３１-１モザイクモール港北１階,045-913-3061,神奈川県
神奈川県,港北ニュータウン支店 ＡＴＭ,神奈川県横浜市都筑区中川中央１-３１-１モザイクモール港北１階,045-913-3061,神奈川県
神奈川県,昭和大学横浜市北部病院 ＡＴＭ,神奈川県横浜市都筑区茅ケ崎中央３５-１,,神奈川県
神奈川県,センター北駅 ＡＴＭ,神奈川県横浜市都筑区中川中央１-１-１,,神奈川県
神奈川県,仲町台駅前 ＡＴＭ,神奈川県横浜市都筑区仲町台１-７-１２,,神奈川県
神奈川県,センター南駅 ＡＴＭ,神奈川県横浜市都筑区茅ケ崎中央１番１号,,神奈川県
神奈川県,モザイクモール港北Ｂ１Ｆ ＡＴＭ,神奈川県横浜市都筑区中川中央一丁目３１番１号,,神奈川県
神奈川県,川崎支店,神奈川県川崎市川崎区砂子２-５-１１,044-245-2111,神奈川県
神奈川県,貝塚一丁目 ＡＴＭ,神奈川県川崎市川崎区貝塚１-１３-１,,神奈川県
神奈川県,川崎支店 ＡＴＭ,神奈川県川崎市川崎区砂子２-５-１１,044-245-2111,神奈川県
神奈川県,川崎アゼリア ＡＴＭ,神奈川県川崎市川崎区駅前本町２６-２,,神奈川県
神奈川県,新川崎支店,神奈川県川崎市幸区鹿島田１-１-３,044-541-4371,神奈川県
神奈川県,新川崎支店 ＡＴＭ,神奈川県川崎市幸区鹿島田１-１-３,044-541-4371,神奈川県
神奈川県,鹿島田駅 ＡＴＭ,神奈川県川崎市幸区鹿島田１-１７-１４,,神奈川県
神奈川県,ららテラス武蔵小杉 ＡＴＭ,神奈川県川崎市中原区新丸子東３-１３０２,,神奈川県
神奈川県,かながわサイエンスパーク ＡＴＭ,神奈川県川崎市高津区坂戸３-２-１,,神奈川県
神奈川県,新百合ヶ丘支店,神奈川県川崎市麻生区上麻生１-５-１,044-954-5111,神奈川県
神奈川県,新百合ヶ丘支店 ＡＴＭ,神奈川県川崎市麻生区上麻生１-５-１,044-954-5111,神奈川県
神奈川県,橋本支店,神奈川県相模原市緑区橋本３-３０-３,042-772-7345,神奈川県
神奈川県,いなげや相模原下九沢店 ＡＴＭ,神奈川県相模原市緑区下九沢１７７９-１,,神奈川県
神奈川県,橋本駅南口 ＡＴＭ,神奈川県相模原市緑区橋本２-２-１,,神奈川県
神奈川県,橋本支店 ＡＴＭ,神奈川県相模原市緑区橋本３-３０-３,042-772-7345,神奈川県
神奈川県,コピオ城山 ＡＴＭ,神奈川県相模原市緑区原宿３-１０-１,,神奈川県
神奈川県,相模大野支店,神奈川県相模原市南区相模大野３-２-１-１０４,042-744-6311,神奈川県
神奈川県,古淵 ＡＴＭ,神奈川県相模原市南区古淵２-１７-３,,神奈川県
神奈川県,相模大野支店 ＡＴＭ,神奈川県相模原市南区相模大野３-２-１-１０４,042-744-6311,神奈川県
神奈川県,横須賀支店,神奈川県横須賀市若松町３-１４-８,046-823-1600,神奈川県
神奈川県,神奈川歯科大学付属病院 ＡＴＭ,神奈川県横須賀市小川町１番地２３,,神奈川県
神奈川県,久里浜 ＡＴＭ,神奈川県横須賀市久里浜４-６-１２,,神奈川県
神奈川県,佐原 ＡＴＭ,神奈川県横須賀市佐原１-７-３,,神奈川県
神奈川県,湘南ハイランド ＡＴＭ,神奈川県横須賀市ハイランド１-５６-１,,神奈川県
神奈川県,横須賀支店 ＡＴＭ,神奈川県横須賀市若松町３-１４-８,046-823-1600,神奈川県
神奈川県,横須賀市役所 ＡＴＭ,神奈川県横須賀市小川町１２,,神奈川県
神奈川県,大船支店,神奈川県鎌倉市大船１-２２-５,0467-46-2111,神奈川県
神奈川県,西鎌倉出張所,神奈川県鎌倉市西鎌倉１-１-５,0467-31-0123,神奈川県
神奈川県,大船支店 ＡＴＭ,神奈川県鎌倉市大船１-２２-５,0467-46-2111,神奈川県
神奈川県,西鎌倉出張所 ＡＴＭ,神奈川県鎌倉市西鎌倉１-１-５,0467-31-0123,神奈川県
神奈川県,長後支店,神奈川県藤沢市下土棚５１０-１３,0466-43-1231,神奈川県
神奈川県,藤沢支店,神奈川県藤沢市藤沢５５５,0466-23-3111,神奈川県
神奈川県,長後駅東口 ＡＴＭ,神奈川県藤沢市下土棚４６７-４,,神奈川県
神奈川県,長後支店 ＡＴＭ,神奈川県藤沢市下土棚５１０-１３,0466-43-1231,神奈川県
神奈川県,藤沢駅南口 ＡＴＭ,神奈川県藤沢市南藤沢２０-１０,,神奈川県
神奈川県,藤沢支店 ＡＴＭ,神奈川県藤沢市藤沢５５５,0466-23-3111,神奈川県
神奈川県,小田原支店,神奈川県小田原市栄町２-９-１,0465-22-1321,神奈川県
神奈川県,小田原支店 ＡＴＭ,神奈川県小田原市栄町２-９-１,0465-22-1321,神奈川県
神奈川県,茅ヶ崎駅南口 ＡＴＭ,神奈川県茅ヶ崎市元町１-１,,神奈川県
神奈川県,三浦 ＡＴＭ,神奈川県三浦市栄町３-３,,神奈川県
神奈川県,厚木支店,神奈川県厚木市旭町１-２５-１-１０１,046-228-1811,神奈川県
神奈川県,厚木支店 ＡＴＭ,神奈川県厚木市旭町１-２５-１-１０１,046-228-1811,神奈川県
神奈川県,鶴間支店,神奈川県大和市西鶴間１-３-５,046-274-5151,神奈川県
神奈川県,鶴間支店 ＡＴＭ,神奈川県大和市西鶴間１-３-５,046-274-5151,神奈川県
神奈川県,南林間東口 ＡＴＭ,神奈川県大和市林間１-５-８,,神奈川県
神奈川県,伊勢原支店,神奈川県伊勢原市伊勢原１-３-６,0463-92-1511,神奈川県
神奈川県,伊勢原支店 ＡＴＭ,神奈川県伊勢原市伊勢原１-３-６,0463-92-1511,神奈川県
神奈川県,海老名支店,神奈川県海老名市中央１-４-２２,046-233-6511,神奈川県
神奈川県,海老名支店 ＡＴＭ,神奈川県海老名市中央１-４-２２,046-233-6511,神奈川県
神奈川県,かしわ台 ＡＴＭ,神奈川県海老名市柏ケ谷７０６-３,,神奈川県
神奈川県,ららぽーと海老名 ＡＴＭ,神奈川県海老名市扇町１３-１　１階,,神奈川県
神奈川県,相模原 ＡＴＭ,神奈川県座間市相模が丘１-２４-１５,,神奈川県
神奈川県,綾瀬市役所 ＡＴＭ,神奈川県綾瀬市早川５５０,,神奈川県
神奈川県,上土棚 ＡＴＭ,神奈川県綾瀬市上土棚南１-１１-３,,神奈川県
神奈川県,愛川 ＡＴＭ,神奈川県愛甲郡愛川町中津４０６１-２０,,神奈川県
新潟県,長岡支店,新潟県長岡市大手通２-４-１０,0258-36-4090,新潟県
新潟県,長岡支店 ＡＴＭ,新潟県長岡市大手通２-４-１０,0258-36-4090,新潟県
山梨県,甲府支店,山梨県甲府市丸の内２-３０-１,055-222-5155,山梨県
山梨県,甲府支店 ＡＴＭ,山梨県甲府市丸の内２-３０-１,055-222-5155,山梨県
長野県,松本支店,長野県松本市中央２-５-６,0263-32-3456,長野県
長野県,松本支店 ＡＴＭ,長野県松本市中央２-５-６,0263-32-3456,長野県
静岡県,静岡 ＡＴＭ,静岡県静岡市葵区伝馬町６-１８,,静岡県
静岡県,浜松支店,静岡県浜松市中央区田町２２４-３１,053-453-0156,静岡県
静岡県,グランドホテル浜松 ＡＴＭ,静岡県浜松市中央区東伊場１-３-１,,静岡県
静岡県,聖隷三方原病院 ＡＴＭ,静岡県浜松市中央区三方原町３４５３,,静岡県
静岡県,浜松支店 ＡＴＭ,静岡県浜松市中央区田町２２４-３１,053-453-0156,静岡県
静岡県,聖隷浜松病院共同 ＡＴＭ,静岡県浜松市中央区住吉２-１２-１２,,静岡県
静岡県,しずてつストア富士吉原店 ＡＴＭ,静岡県富士市浅間本町１-４９,,静岡県
愛知県,今池支店,愛知県名古屋市千種区今池５-１-５,052-732-5311,愛知県
愛知県,今池支店 ＡＴＭ,愛知県名古屋市千種区今池５-１-５,052-732-5311,愛知県
愛知県,大曽根 ＡＴＭ,愛知県名古屋市東区矢田南５-２-６２,,愛知県
