地域,支店名,住所,電話番号,都道府県名
愛知県,名古屋駅前支店,愛知県名古屋市中村区名駅一丁目１番３号ＪＲゲートタワー２９階,052-541-2266,愛知県
愛知県,名古屋駅前支店 ＡＴＭ,愛知県名古屋市中村区名駅一丁目１番３号ＪＲゲートタワー２９階,052-541-2266,愛知県
愛知県,名古屋三井ビルディング新館１階 ＡＴＭ,愛知県名古屋市中村区名駅南１-２４-２０,,愛知県
愛知県,名鉄名古屋駅 ＡＴＭ,愛知県名古屋市中村区名駅１-２-１,,愛知県
愛知県,ＪＲセントラルタワーズ桜通口 ＡＴＭ,愛知県名古屋市中村区名駅１-１-４　１階,,愛知県
愛知県,ＪＲゲートタワー ＡＴＭ,愛知県名古屋市中村区名駅１-１-３　２階,,愛知県
愛知県,赤門通支店,愛知県名古屋市中区大須３-３０-２０,052-241-4101,愛知県
愛知県,名古屋支店,愛知県名古屋市中区錦２-１４-１９,052-201-8511,愛知県
愛知県,赤門通支店 ＡＴＭ,愛知県名古屋市中区大須３-３０-２０,052-241-4101,愛知県
愛知県,栄 ＡＴＭ,愛知県名古屋市中区錦３-２４-２４,,愛知県
愛知県,名古屋支店 ＡＴＭ,愛知県名古屋市中区錦２-１４-１９,052-201-8511,愛知県
愛知県,滝子 ＡＴＭ,愛知県名古屋市昭和区滝子通２-１４-１,,愛知県
愛知県,熱田 ＡＴＭ,愛知県名古屋市熱田区伝馬１丁目４番１２号,,愛知県
愛知県,尾張一宮駅前 ＡＴＭ,愛知県一宮市栄３-２-１３,,愛知県
愛知県,春日井 ＡＴＭ,愛知県春日井市鳥居松町５-６１,,愛知県
三重県,津支店,三重県津市東丸之内２０-１２,059-226-5106,三重県
三重県,津支店 ＡＴＭ,三重県津市東丸之内２０-１２,059-226-5106,三重県
三重県,四日市 ＡＴＭ,三重県四日市市安島１-１-５６,,三重県
滋賀県,ビエラ大津 ＡＴＭ,滋賀県大津市春日町１番３号１階,,滋賀県
滋賀県,彦根支店,滋賀県彦根市中央町６-１８,0749-22-2121,滋賀県
滋賀県,彦根支店 ＡＴＭ,滋賀県彦根市中央町６-１８,0749-22-2121,滋賀県
滋賀県,ブリヂストン彦根生活協同組合 ＡＴＭ,滋賀県彦根市高宮町２１１,,滋賀県
滋賀県,パナソニック前岡町 ＡＴＭ,滋賀県彦根市岡町３３,,滋賀県
京都府,下鴨 ＡＴＭ,京都府京都市左京区下鴨西本町３２,,京都
京都府,四条大宮支店,京都府京都市中京区大宮通錦小路下ル錦大宮町１２４-２,075-841-5371,京都
京都府,千本支店,京都府京都市中京区聚楽廻東町３-３,075-841-5325,京都
京都府,京都支店,京都府京都市中京区烏丸通四条上ル笋町６９１,075-221-1141,京都
京都府,四条大宮支店 ＡＴＭ,京都府京都市中京区大宮通錦小路下ル錦大宮町１２４-２,075-841-5371,京都
京都府,千本支店 ＡＴＭ,京都府京都市中京区聚楽廻東町３-３,075-841-5325,京都
京都府,京都支店 ＡＴＭ,京都府京都市中京区烏丸通四条上ル笋町６９１,075-221-1141,京都
京都府,祇園 ＡＴＭ,京都府京都市東山区四条通大和大路西入中之町２１６,,京都
京都府,朱雀 ＡＴＭ,京都府京都市下京区朱雀北ノ口町２９-２,,京都
京都府,ＪＲ京都駅 ＡＴＭ,京都府京都市下京区烏丸通塩小路下ル東塩小路町,,京都
京都府,京都ヨドバシ ＡＴＭ,京都府京都市下京区烏丸通七条下る東塩小路町５９０-２地下１階,,京都
京都府,向日 ＡＴＭ,京都府向日市寺戸町初田２７-３,,京都
京都府,長岡天神支店,京都府長岡京市長岡２-３０-１９,075-951-6366,京都
京都府,長岡天神支店 ＡＴＭ,京都府長岡京市長岡２-３０-１９,075-951-6366,京都
京都府,松井山手出張所,京都府京田辺市山手中央１-１２,0774-63-4241,京都
京都府,松井山手出張所 ＡＴＭ,京都府京田辺市山手中央１-１２,0774-63-4241,京都
京都府,アル・プラザ木津 ＡＴＭ,京都府木津川市相楽城西１５,,京都
大阪府,京阪京橋支店,大阪府大阪市都島区東野田町２-２-１０都島住宅京橋ビル４階,06-6353-2121,大阪府
大阪府,都島支店,大阪府大阪市都島区都島本通３-２２-１１,06-6921-7731,大阪府
大阪府,京阪京橋支店 ＡＴＭ,大阪府大阪市都島区東野田町２-２-１０都島住宅京橋ビル４階,06-6353-2121,大阪府
大阪府,都島支店 ＡＴＭ,大阪府大阪市都島区都島本通３-２２-１１,06-6921-7731,大阪府
大阪府,京阪モール前 ＡＴＭ,大阪府大阪市都島区東野田町２-３-２１,,大阪府
大阪府,野田支店,大阪府大阪市福島区大開１-１-１２,06-6462-5331,大阪府
大阪府,福島支店,大阪府大阪市福島区福島３-１４-２１,06-6451-1831,大阪府
大阪府,野田支店 ＡＴＭ,大阪府大阪市福島区大開１-１-１２,06-6462-5331,大阪府
大阪府,福島駅前 ＡＴＭ,大阪府大阪市福島区福島２-８-２３,,大阪府
大阪府,福島支店 ＡＴＭ,大阪府大阪市福島区福島３-１４-２１,06-6451-1831,大阪府
大阪府,地下鉄野田阪神駅 ＡＴＭ,大阪府大阪市福島区大開１-４-１８,,大阪府
大阪府,高見フローラルタウン ＡＴＭ,大阪府大阪市此花区高見１-４-５０,,大阪府
大阪府,大阪西区支店,大阪府大阪市西区立売堀３-１-１４,06-6531-8131,大阪府
大阪府,大阪西区支店 ＡＴＭ,大阪府大阪市西区立売堀３-１-１４,06-6531-8131,大阪府
大阪府,ドームシティガスビル ＡＴＭ,大阪府大阪市西区千代崎３-南２-３７,,大阪府
大阪府,ナインモール九条 ＡＴＭ,大阪府大阪市西区九条１-１６-２６,,大阪府
大阪府,なにわ筋 ＡＴＭ,大阪府大阪市西区新町１-２８-１１,,大阪府
大阪府,西長堀駅前 ＡＴＭ,大阪府大阪市西区南堀江３-１２-１７,,大阪府
大阪府,四ツ橋駅前 ＡＴＭ,大阪府大阪市西区北堀江１-１-２９,,大阪府
大阪府,地下鉄ドーム前千代崎駅 ＡＴＭ,大阪府大阪市西区千代崎三丁目北-２-８,,大阪府
大阪府,市岡支店,大阪府大阪市港区磯路１-３-３,06-6572-8881,大阪府
大阪府,市岡支店 ＡＴＭ,大阪府大阪市港区磯路１-３-３,06-6572-8881,大阪府
大阪府,大正支店,大阪府大阪市大正区千島２-５-１５,06-6554-2211,大阪府
大阪府,大正駅前 ＡＴＭ,大阪府大阪市大正区三軒家東１-２-７,,大阪府
大阪府,大正支店 ＡＴＭ,大阪府大阪市大正区千島２-５-１５,06-6554-2211,大阪府
大阪府,上六支店,大阪府大阪市天王寺区上本町６-５-１３,06-6772-1151,大阪府
大阪府,上本町駅前 ＡＴＭ,大阪府大阪市天王寺区上本町６-２-２６,,大阪府
大阪府,上六支店 ＡＴＭ,大阪府大阪市天王寺区上本町６-５-１３,06-6772-1151,大阪府
大阪府,大阪赤十字病院 ＡＴＭ,大阪府大阪市天王寺区筆ヶ崎町５-３０,,大阪府
大阪府,寺田町駅前 ＡＴＭ,大阪府大阪市天王寺区大道４-１０-１１,,大阪府
大阪府,天王寺ミオ・ＥＡＳＴ ＡＴＭ,大阪府大阪市天王寺区悲田院町１０-３９,,大阪府
大阪府,桃谷駅前 ＡＴＭ,大阪府大阪市天王寺区烏ケ辻１-１-７,,大阪府
大阪府,夕陽ヶ丘駅前 ＡＴＭ,大阪府大阪市天王寺区六万体町５-１６,,大阪府
大阪府,地下鉄谷町九丁目駅 ＡＴＭ,大阪府大阪市天王寺区生玉前町１-２４,,大阪府
大阪府,桜川支店,大阪府大阪市浪速区幸町２-７-３,06-6561-7831,大阪府
大阪府,大阪恵美須 ＡＴＭ,大阪府大阪市浪速区恵美須西１-２-１,,大阪府
大阪府,桜川支店 ＡＴＭ,大阪府大阪市浪速区幸町２-７-３,06-6561-7831,大阪府
大阪府,大国町 ＡＴＭ,大阪府大阪市浪速区戎本町１-７-２５,,大阪府
大阪府,歌島橋支店,大阪府大阪市西淀川区御幣島２-１-２,06-6471-2251,大阪府
大阪府,歌島橋支店 ＡＴＭ,大阪府大阪市西淀川区御幣島２-１-２,06-6471-2251,大阪府
大阪府,メラード大和田 ＡＴＭ,大阪府大阪市西淀川区大和田２-２-４３,,大阪府
大阪府,上新庄支店,大阪府大阪市東淀川区瑞光１-１１-５,06-6325-4500,大阪府
大阪府,相川駅前 ＡＴＭ,大阪府大阪市東淀川区相川２-２０-９,,大阪府
大阪府,上新庄支店 ＡＴＭ,大阪府大阪市東淀川区瑞光１-１１-５,06-6325-4500,大阪府
大阪府,鶴橋支店,大阪府大阪市東成区東小橋３-１９-５,06-6971-0331,大阪府
大阪府,布施口支店,大阪府大阪市東成区深江南３-２２-９,06-6971-6451,大阪府
大阪府,鶴橋支店 ＡＴＭ,大阪府大阪市東成区東小橋３-１９-５,06-6971-0331,大阪府
大阪府,布施口支店 ＡＴＭ,大阪府大阪市東成区深江南３-２２-９,06-6971-6451,大阪府
大阪府,生野支店,大阪府大阪市生野区中川６-９-１８,06-6751-1251,大阪府
大阪府,生野支店 ＡＴＭ,大阪府大阪市生野区中川６-９-１８,06-6751-1251,大阪府
大阪府,北巽駅前 ＡＴＭ,大阪府大阪市生野区巽中１-２３-６-１０１,,大阪府
大阪府,近鉄鶴橋駅 ＡＴＭ,大阪府大阪市生野区鶴橋２-１-２０,,大阪府
大阪府,京阪千林駅前 ＡＴＭ,大阪府大阪市旭区千林１-１１-１０,,大阪府
大阪府,城東支店,大阪府大阪市城東区今福西１-８-２,06-6932-4371,大阪府
大阪府,野江支店,大阪府大阪市城東区野江４-１-３,06-6931-5151,大阪府
大阪府,京阪関目駅前 ＡＴＭ,大阪府大阪市城東区関目五丁目１番２４号,,大阪府
大阪府,鴫野 ＡＴＭ,大阪府大阪市城東区鴫野東３-３-１,,大阪府
大阪府,鴫野西 ＡＴＭ,大阪府大阪市城東区鴫野西４-１-３,,大阪府
大阪府,城東支店 ＡＴＭ,大阪府大阪市城東区今福西１-８-２,06-6932-4371,大阪府
大阪府,野江支店 ＡＴＭ,大阪府大阪市城東区野江４-１-３,06-6931-5151,大阪府
大阪府,阿倍野橋支店,大阪府大阪市阿倍野区阿倍野筋１-５-１０-１００あべのｎｉｎｉ内,06-6632-1031,大阪府
大阪府,阿倍野橋支店 ＡＴＭ,大阪府大阪市阿倍野区阿倍野筋１-５-１０-１００あべのｎｉｎｉ内,06-6632-1031,大阪府
大阪府,近鉄大阪阿部野橋駅東口 ＡＴＭ,大阪府大阪市阿倍野区阿倍野筋１-１-４３,,大阪府
大阪府,近鉄大阪阿部野橋駅 ＡＴＭ,大阪府大阪市阿倍野区阿倍野筋１-１-１,,大阪府
大阪府,あべのハルカスオフィスロビー ＡＴＭ,大阪府大阪市阿倍野区阿倍野筋１-１-４３　１７階,,大阪府
大阪府,我孫子支店,大阪府大阪市住吉区我孫子東２-６-４,06-6692-2825,大阪府
大阪府,住吉支店,大阪府大阪市住吉区長峡町２-７,06-6673-1231,大阪府
大阪府,我孫子支店 ＡＴＭ,大阪府大阪市住吉区我孫子東２-６-４,06-6692-2825,大阪府
大阪府,ＪＲ我孫子町駅前 ＡＴＭ,大阪府大阪市住吉区我孫子３-１１-２９,,大阪府
大阪府,杉本町駅前 ＡＴＭ,大阪府大阪市住吉区山之内３-２-２,,大阪府
大阪府,住吉支店 ＡＴＭ,大阪府大阪市住吉区長峡町２-７,06-6673-1231,大阪府
大阪府,地下鉄長居駅 ＡＴＭ,大阪府大阪市住吉区長居東４-６-５,,大阪府
大阪府,田辺支店,大阪府大阪市東住吉区南田辺１-９-３８,06-6622-2171,大阪府
大阪府,駒川中野駅前 ＡＴＭ,大阪府大阪市東住吉区駒川３-２７-２５-１０１,,大阪府
大阪府,田辺支店 ＡＴＭ,大阪府大阪市東住吉区南田辺１-９-３８,06-6622-2171,大阪府
大阪府,萩ノ茶屋支店,大阪府大阪市西成区鶴見橋１-３-１０,06-6641-2651,大阪府
大阪府,南海天下茶屋駅 ＡＴＭ,大阪府大阪市西成区岸里１-１-９,,大阪府
大阪府,萩ノ茶屋支店 ＡＴＭ,大阪府大阪市西成区鶴見橋１-３-１０,06-6641-2651,大阪府
大阪府,地下鉄動物園前駅 ＡＴＭ,大阪府大阪市西成区太子１-６-１２,,大阪府
大阪府,新大阪駅前支店,大阪府大阪市淀川区西中島４-３-１４,06-6305-1171,大阪府
大阪府,三国支店,大阪府大阪市淀川区西三国３-４-１２,06-6391-1121,大阪府
大阪府,神崎川駅前 ＡＴＭ,大阪府大阪市淀川区新高６-１４-１７,,大阪府
大阪府,新大阪駅北口 ＡＴＭ,大阪府大阪市淀川区宮原３-３-３８,,大阪府
大阪府,新大阪駅前支店 ＡＴＭ,大阪府大阪市淀川区西中島４-３-１４,06-6305-1171,大阪府
大阪府,西中島 ＡＴＭ,大阪府大阪市淀川区西中島３-１０-１２,,大阪府
大阪府,阪急三国駅 ＡＴＭ,大阪府大阪市淀川区新高３-６-３３-２０２Ｂ,,大阪府
大阪府,東三国駅前 ＡＴＭ,大阪府大阪市淀川区東三国５-２-２０,,大阪府
大阪府,三国支店 ＡＴＭ,大阪府大阪市淀川区西三国３-４-１２,06-6391-1121,大阪府
大阪府,ＪＲ新大阪駅 ＡＴＭ,大阪府大阪市淀川区西中島５丁目１６番１号,,大阪府
大阪府,地下鉄西中島南方駅 ＡＴＭ,大阪府大阪市淀川区西中島１-１２-１,,大阪府
大阪府,今福鶴見駅前 ＡＴＭ,大阪府大阪市鶴見区鶴見３-５-１０,,大阪府
大阪府,イオンモール鶴見緑地 ＡＴＭ,大阪府大阪市鶴見区鶴見４-１７-１,,大阪府
大阪府,平林支店,大阪府大阪市住之江区新北島３-８-２９,06-6683-3801,大阪府
大阪府,北加賀屋駅前 ＡＴＭ,大阪府大阪市住之江区北加賀屋２-１１-８,,大阪府
大阪府,住之江ショッピングプラザ ＡＴＭ,大阪府大阪市住之江区新北島３-３-１９,,大阪府
大阪府,平林支店 ＡＴＭ,大阪府大阪市住之江区新北島３-８-２９,06-6683-3801,大阪府
大阪府,大阪府庁咲洲庁舎 ＡＴＭ,大阪府大阪市住之江区南港北１-１４-１６　１８階,,大阪府
大阪府,長吉支店,大阪府大阪市平野区長吉長原１-１-３,06-6790-5521,大阪府
大阪府,平野支店,大阪府大阪市平野区平野西５-１-８,06-6703-1881,大阪府
大阪府,長吉支店 ＡＴＭ,大阪府大阪市平野区長吉長原１-１-３,06-6790-5521,大阪府
大阪府,平野支店 ＡＴＭ,大阪府大阪市平野区平野西５-１-８,06-6703-1881,大阪府
大阪府,梅田北口支店,大阪府大阪市北区角田町８-１大阪梅田ツインタワーズ・ノース２４階梅田支店内,06-6313-3701,大阪府
大阪府,梅田支店,大阪府大阪市北区角田町８-１大阪梅田ツインタワーズ・ノース２４階,06-6312-8571,大阪府
大阪府,天六支店,大阪府大阪市北区浪花町１４番２５号　ＫＲＤ天六ビル３階,06-6374-9131,大阪府
大阪府,堂島支店,大阪府大阪市北区角田町８-１大阪梅田ツインタワーズ・ノース２４階梅田支店内,06-6312-8191,大阪府
大阪府,南森町支店,大阪府大阪市北区天神橋２-北２-６,06-6351-6251,大阪府
大阪府,梅田北口支店 ＡＴＭ,大阪府大阪市北区角田町８-１大阪梅田ツインタワーズ・ノース２４階梅田支店内,06-6313-3701,大阪府
大阪府,梅田支店 ＡＴＭ,大阪府大阪市北区角田町８-１大阪梅田ツインタワーズ・ノース２４階,06-6312-8571,大阪府
大阪府,地下鉄中津駅前 ＡＴＭ,大阪府大阪市北区中津１-６-３２,,大阪府
大阪府,ディアモール大阪 ＡＴＭ,大阪府大阪市北区梅田１丁目大阪駅前ダイヤモンド地下街２号,,大阪府
大阪府,天六支店 ＡＴＭ,大阪府大阪市北区浪花町１４番２５号　ＫＲＤ天六ビル３階,06-6374-9131,大阪府
大阪府,堂島支店 ＡＴＭ,大阪府大阪市北区角田町８-１大阪梅田ツインタワーズ・ノース２４階梅田支店内,06-6312-8191,大阪府
大阪府,長柄 ＡＴＭ,大阪府大阪市北区長柄中１-６-１７,,大阪府
大阪府,南森町支店 ＡＴＭ,大阪府大阪市北区天神橋２-北２-６,06-6351-6251,大阪府
大阪府,阪神梅田駅 ＡＴＭ,大阪府大阪市北区梅田３丁目大阪駅前地下街３号,,大阪府
大阪府,ホワイティうめだ ＡＴＭ,大阪府大阪市北区曽根崎２-１６-１９,,大阪府
大阪府,大阪駅桜橋口 ＡＴＭ,大阪府大阪市北区梅田３-１-１,,大阪府
大阪府,大阪駅中央 ＡＴＭ,大阪府大阪市北区梅田３-１-１,,大阪府
大阪府,阪急グランドビル ＡＴＭ,大阪府大阪市北区角田町８-４７,,大阪府
大阪府,サン広場地下通り ＡＴＭ,大阪府大阪市北区角田町８-４７,,大阪府
大阪府,グランフロント大阪南館 ＡＴＭ,大阪府大阪市北区大深町４-２０地下１階,,大阪府
大阪府,阪急三番街 ＡＴＭ,大阪府大阪市北区芝田１-１-３　１階,,大阪府
大阪府,ヤンマー本社ビル ＡＴＭ,大阪府大阪市北区茶屋町１-３２　地下２階,,大阪府
大阪府,中之島フェスティバルタワー・ウエスト ＡＴＭ,大阪府大阪市北区中之島３-２-４　３階,,大阪府
大阪府,地下鉄南森町駅 ＡＴＭ,大阪府大阪市北区南森町２-１-４,,大阪府
大阪府,地下鉄東梅田駅 ＡＴＭ,大阪府大阪市北区曽根崎２-１１-１１,,大阪府
大阪府,セブンデイズプラザ阪急梅田 ＡＴＭ,大阪府大阪市北区芝田一丁目１番３号地下１階,,大阪府
大阪府,梅田スカイビル ＡＴＭ,大阪府大阪市北区大淀中１-１-８８　３階,,大阪府
大阪府,ヨドバシ梅田タワー ＡＴＭ,大阪府大阪市北区大深町１-１地下１階,,大阪府
大阪府,地下鉄西梅田駅 ＡＴＭ,大阪府大阪市北区梅田２-２-２５,,大阪府
大阪府,ドーチカ ＡＴＭ,大阪府大阪市北区曽根崎新地１丁目　堂島地下街４号,,大阪府
大阪府,天神橋筋六丁目駅前 ＡＴＭ,大阪府大阪市北区天神橋７-１-２４ジオタワー天六内,,大阪府
大阪府,大阪営業部,大阪府大阪市中央区備後町２-２-１,06-6271-1221,大阪府
大阪府,大手支店,大阪府大阪市中央区大手前２-１-２２大阪府庁本館,06-6942-5055,大阪府
大阪府,北浜支店,大阪府大阪市中央区平野町４-１-２大阪ガスビル御堂筋支店内,06-6222-3551,大阪府
大阪府,船場支店,大阪府大阪市中央区平野町４-１-２大阪ガスビル内御堂筋支店内,06-6228-5777,大阪府
大阪府,玉造支店,大阪府大阪市中央区玉造１-７-４,06-6762-5071,大阪府
大阪府,難波支店,大阪府大阪市中央区難波五丁目１番６０号なんばスカイオ１９階,06-6632-5031,大阪府
大阪府,御堂筋支店,大阪府大阪市中央区平野町４-１-２,06-6202-5531,大阪府
大阪府,咲洲出張所,大阪府大阪市中央区大手前２-１-２２大阪府庁本館大手支店内,06-6942-5055,大阪府
大阪府,イケマン堺筋ビル ＡＴＭ,大阪府大阪市中央区南本町２-２-５,,大阪府
大阪府,大阪営業部 ＡＴＭ,大阪府大阪市中央区備後町２-２-１,06-6271-1221,大阪府
大阪府,大阪ビジネスパーク ＡＴＭ,大阪府大阪市中央区城見２-１-６１,,大阪府
大阪府,北浜支店 ＡＴＭ,大阪府大阪市中央区平野町４-１-２大阪ガスビル御堂筋支店内,06-6222-3551,大阪府
大阪府,久太郎町 ＡＴＭ,大阪府大阪市中央区久太郎町２-５-２８,,大阪府
大阪府,クリスタ長堀 ＡＴＭ,大阪府大阪市中央区南船場２丁目長堀地下街１号,,大阪府
大阪府,船場支店 ＡＴＭ,大阪府大阪市中央区平野町４-１-２大阪ガスビル内御堂筋支店内,06-6228-5777,大阪府
大阪府,第二野村ビル ＡＴＭ,大阪府大阪市中央区備後町２-１-８,,大阪府
大阪府,谷町 ＡＴＭ,大阪府大阪市中央区谷町２-４-３,,大阪府
大阪府,玉造支店 ＡＴＭ,大阪府大阪市中央区玉造１-７-４,06-6762-5071,大阪府
大阪府,地下鉄本町駅 ＡＴＭ,大阪府大阪市中央区本町４-１-１５,,大阪府
大阪府,難波支店 ＡＴＭ,大阪府大阪市中央区難波五丁目１番６０号なんばスカイオ１９階,06-6632-5031,大阪府
大阪府,日本橋駅前 ＡＴＭ,大阪府大阪市中央区日本橋１-１８-１５,,大阪府
大阪府,ファッションスクウェア江綿 ＡＴＭ,大阪府大阪市中央区南本町３-１-８,,大阪府
大阪府,御堂筋支店 ＡＴＭ,大阪府大阪市中央区平野町４-１-２,06-6202-5531,大阪府
大阪府,京阪天満橋駅 ＡＴＭ,大阪府大阪市中央区天満橋京町１-１,,大阪府
大阪府,森ノ宮駅前 ＡＴＭ,大阪府大阪市中央区森ノ宮中央１-１４-１７,,大阪府
大阪府,咲洲出張所 ＡＴＭ,大阪府大阪市中央区大手前２-１-２２大阪府庁本館大手支店内,06-6942-5055,大阪府
大阪府,南海なんば駅 ＡＴＭ,大阪府大阪市中央区難波５-１-６０,,大阪府
大阪府,ｅｋｉｍｏなんば北 ＡＴＭ,大阪府大阪市中央区難波１-９-７,,大阪府
大阪府,クリスタ長堀・心斎橋 ＡＴＭ,大阪府大阪市中央区南船場４丁目長堀地下街６号,,大阪府
大阪府,心斎橋 ＡＴＭ,大阪府大阪市中央区南船場４-５-１０,,大阪府
大阪府,大手支店 ＡＴＭ,大阪府大阪市中央区大手前２-１-２２大阪府庁本館,06-6942-5055,大阪府
大阪府,ｅｋｉｍｏなんば南 ＡＴＭ,大阪府大阪市中央区難波１-９-７,,大阪府
大阪府,地下鉄谷町四丁目駅 ＡＴＭ,大阪府大阪市中央区谷町三丁目１２,,大阪府
大阪府,地下鉄森ノ宮駅 ＡＴＭ,大阪府大阪市中央区森ノ宮中央１-１-４３,,大阪府
大阪府,地下鉄長堀橋駅 ＡＴＭ,大阪府大阪市中央区島之内１-１８-９,,大阪府
大阪府,なんばＣＩＴＹ１階 ＡＴＭ,大阪府大阪市中央区難波５-１-６０,,大阪府
大阪府,地下鉄堺筋本町駅 ＡＴＭ,大阪府大阪市中央区船場中央１-４-１６,,大阪府
大阪府,本町南ガーデンシティ ＡＴＭ,大阪府大阪市中央区北久宝寺町３-６-１　１階,,大阪府
大阪府,地下鉄心斎橋駅 ＡＴＭ,大阪府大阪市中央区西心斎橋１-４,,大阪府
大阪府,地下鉄松屋町駅 ＡＴＭ,大阪府大阪市中央区松屋町３-２７,,大阪府
大阪府,京阪淀屋橋駅 ＡＴＭ,大阪府大阪市中央区北浜３-１-２５,,大阪府
大阪府,地下鉄北浜駅 ＡＴＭ,大阪府大阪市中央区北浜１-８-１６地下１階,,大阪府
大阪府,金岡支店,大阪府堺市堺区北三国ヶ丘町８丁８-１８,072-238-6785,大阪府
大阪府,堺支店,大阪府堺市堺区東湊町１丁８７-２,072-245-7111,大阪府
大阪府,堺東支店,大阪府堺市堺区北瓦町２丁４-１８,072-221-9001,大阪府
大阪府,金岡支店 ＡＴＭ,大阪府堺市堺区北三国ヶ丘町８丁８-１８,072-238-6785,大阪府
大阪府,堺支店 ＡＴＭ,大阪府堺市堺区東湊町１丁８７-２,072-245-7111,大阪府
大阪府,堺東支店 ＡＴＭ,大阪府堺市堺区北瓦町２丁４-１８,072-221-9001,大阪府
大阪府,南海堺駅 ＡＴＭ,大阪府堺市堺区戎島町３丁２２-１,,大阪府
大阪府,深井支店,大阪府堺市中区深井沢町３２９０,072-279-2521,大阪府
大阪府,深井支店 ＡＴＭ,大阪府堺市中区深井沢町３２９０,072-279-2521,大阪府
大阪府,深阪 ＡＴＭ,大阪府堺市中区深阪２-１０-４６,,大阪府
大阪府,初芝支店,大阪府堺市東区日置荘西町１丁２２-２８,072-287-2741,大阪府
大阪府,初芝支店 ＡＴＭ,大阪府堺市東区日置荘西町１丁２２-２８,072-287-2741,大阪府
大阪府,北野田駅前 ＡＴＭ,大阪府堺市東区北野田１-１ヴェリテ北野田プラチナム１階,,大阪府
大阪府,光明池支店,大阪府堺市南区鴨谷台２丁２-２,072-298-0151,大阪府
大阪府,泉北支店,大阪府堺市南区茶山台１丁２,072-291-3001,大阪府
大阪府,泉北とが支店,大阪府堺市南区原山台２-２-１トナリエ栂・美木多内,072-299-5331,大阪府
大阪府,光明池支店 ＡＴＭ,大阪府堺市南区鴨谷台２丁２-２,072-298-0151,大阪府
大阪府,泉北支店 ＡＴＭ,大阪府堺市南区茶山台１丁２,072-291-3001,大阪府
大阪府,泉北とが支店 ＡＴＭ,大阪府堺市南区原山台２-２-１トナリエ栂・美木多内,072-299-5331,大阪府
大阪府,ライフ城山台店 ＡＴＭ,大阪府堺市南区城山台２丁２-１４,,大阪府
大阪府,泉ケ丘駅 ＡＴＭ,大阪府堺市南区竹城台一丁１番１号,,大阪府
大阪府,新金岡支店,大阪府堺市北区新金岡町４丁１-１２,072-255-4711,大阪府
大阪府,北花田駅前 ＡＴＭ,大阪府堺市北区北花田町１丁２-１,,大阪府
大阪府,蔵前 ＡＴＭ,大阪府堺市北区蔵前町１丁７番１１号,,大阪府
大阪府,新金岡支店 ＡＴＭ,大阪府堺市北区新金岡町４丁１-１２,072-255-4711,大阪府
大阪府,久米田支店,大阪府岸和田市大町４８４-１,072-443-6101,大阪府
大阪府,久米田支店 ＡＴＭ,大阪府岸和田市大町４８４-１,072-443-6101,大阪府
