地域,支店名,住所,電話番号,都道府県名
北海道,札幌支店,北海道札幌市中央区北１条西４-１-２,011-221-5151,北海道
北海道,札幌支店 ＡＴＭ,北海道札幌市中央区北１条西４-１-２,011-221-5151,北海道
宮城県,仙台支店,宮城県仙台市青葉区一番町３-６-１一番町平和ビル１階,022-262-1161,宮城県
宮城県,仙台支店 ＡＴＭ,宮城県仙台市青葉区一番町３-６-１一番町平和ビル１階,022-262-1161,宮城県
茨城県,土浦支店,茨城県土浦市大和町１-１,029-822-6721,茨城県
茨城県,土浦支店 ＡＴＭ,茨城県土浦市大和町１-１,029-822-6721,茨城県
茨城県,つくば ＡＴＭ,茨城県つくば市吾妻１-６-１つくばトナリエキュート１階,,茨城県
栃木県,宇都宮支店,栃木県宇都宮市馬場通り４-３-１２,028-622-5281,栃木県
栃木県,宇都宮支店 ＡＴＭ,栃木県宇都宮市馬場通り４-３-１２,028-622-5281,栃木県
栃木県,栃木 ＡＴＭ,栃木県栃木市沼和田町７-１３,,栃木県
群馬県,前橋支店,群馬県前橋市本町１-２-１６,027-231-6241,群馬県
群馬県,前橋支店 ＡＴＭ,群馬県前橋市本町１-２-１６,027-231-6241,群馬県
埼玉県,西武秩父駅前温泉祭の湯 ＡＴＭ,埼玉県秩父市野坂町１-１６-１５,,埼玉県
埼玉県,朝霞台支店,埼玉県朝霞市東弁財１-３-１１,048-474-1131,埼玉県
埼玉県,朝霞台支店 ＡＴＭ,埼玉県朝霞市東弁財１-３-１１,048-474-1131,埼玉県
埼玉県,ライフ新座店 ＡＴＭ,埼玉県新座市栗原４-１２-２５,,埼玉県
千葉県,千葉支店,千葉県千葉市中央区中央１-１-３,043-225-1133,千葉県
千葉県,千葉支店 ＡＴＭ,千葉県千葉市中央区中央１-１-３,043-225-1133,千葉県
千葉県,千葉駅前 ＡＴＭ,千葉県千葉市中央区富士見１-１-１,,千葉県
千葉県,稲毛 ＡＴＭ,千葉県千葉市稲毛区小仲台２-５-１２,,千葉県
千葉県,市川支店,千葉県市川市八幡２-６-１３,047-334-0185,千葉県
千葉県,行徳支店,千葉県市川市行徳駅前２-１-１５,047-357-6161,千葉県
千葉県,市川支店 ＡＴＭ,千葉県市川市八幡２-６-１３,047-334-0185,千葉県
千葉県,行徳支店 ＡＴＭ,千葉県市川市行徳駅前２-１-１５,047-357-6161,千葉県
千葉県,北習志野支店,千葉県船橋市習志野台２-４９-１,047-465-7311,千葉県
千葉県,船橋支店,千葉県船橋市本町７-７-１,047-423-4701,千葉県
千葉県,北習志野支店 ＡＴＭ,千葉県船橋市習志野台２-４９-１,047-465-7311,千葉県
千葉県,船橋支店 ＡＴＭ,千葉県船橋市本町７-７-１,047-423-4701,千葉県
千葉県,ヨークマート習志野台店 ＡＴＭ,千葉県船橋市習志野台３-６-１,,千葉県
千葉県,北小金支店,千葉県松戸市小金４９-３,047-342-1171,千葉県
千葉県,北小金支店 ＡＴＭ,千葉県松戸市小金４９-３,047-342-1171,千葉県
千葉県,新松戸駅前 ＡＴＭ,千葉県松戸市新松戸１-４３２,,千葉県
千葉県,野菊野 ＡＴＭ,千葉県松戸市野菊野１野菊野団地１-１０３号,,千葉県
千葉県,松戸ニッセイエデンの園 ＡＴＭ,千葉県松戸市高塚新田１２３-１５,,千葉県
千葉県,馬橋 ＡＴＭ,千葉県松戸市西馬橋蔵元町６,,千葉県
千葉県,茂原支店,千葉県茂原市千代田町１-４-１,0475-23-6211,千葉県
千葉県,アスモ ＡＴＭ,千葉県茂原市高師１７３５,,千葉県
千葉県,茂原支店 ＡＴＭ,千葉県茂原市千代田町１-４-１,0475-23-6211,千葉県
千葉県,成田支店,千葉県成田市花崎町８２１-４,0476-22-5721,千葉県
千葉県,成田支店 ＡＴＭ,千葉県成田市花崎町８２１-４,0476-22-5721,千葉県
千葉県,津田沼支店,千葉県習志野市津田沼１-２-１,047-475-2151,千葉県
千葉県,津田沼支店 ＡＴＭ,千葉県習志野市津田沼１-２-１,047-475-2151,千葉県
千葉県,柏支店,千葉県柏市旭町１-５-１,04-7145-7121,千葉県
千葉県,柏支店 ＡＴＭ,千葉県柏市旭町１-５-１,04-7145-7121,千葉県
千葉県,柏の葉キャンパス駅 ＡＴＭ,千葉県柏市若柴１７４,,千葉県
千葉県,流山おおたかの森出張所,千葉県流山市おおたかの森北１-１-１　１階,04-7154-7091,千葉県
千葉県,江戸川台駅東口 ＡＴＭ,千葉県流山市江戸川台東２-４,,千葉県
千葉県,流山おおたかの森出張所 ＡＴＭ,千葉県流山市おおたかの森北１-１-１　１階,04-7154-7091,千葉県
千葉県,流山おおたかの森駅 ＡＴＭ,千葉県流山市おおたかの森西１-１-１,,千葉県
千葉県,浦安支店,千葉県浦安市北栄１-１６-１,047-353-5511,千葉県
千葉県,浦安支店 ＡＴＭ,千葉県浦安市北栄１-１６-１,047-353-5511,千葉県
東京都,市ヶ谷支店,東京都千代田区九段南４-８-２６,03-3262-7611,東京都
東京都,神田支店,東京都千代田区九段南１-５-６　九段支店内,03-3251-7231,東京都
東京都,九段支店,東京都千代田区九段南１-５-６,03-3261-1185,東京都
東京都,東京営業部,東京都千代田区丸の内２-７-２　ＪＰタワー１８階,03-6704-1111,東京都
東京都,飯田橋駅東口 ＡＴＭ,東京都千代田区飯田橋４-１-１０,,東京都
東京都,市ヶ谷支店 ＡＴＭ,東京都千代田区九段南４-８-２６,03-3262-7611,東京都
東京都,都営地下鉄岩本町駅 ＡＴＭ,東京都千代田区神田岩本町１,,東京都
東京都,神田駅西口 ＡＴＭ,東京都千代田区内神田３丁目８番８号,,東京都
東京都,神田支店 ＡＴＭ,東京都千代田区九段南１-５-６　九段支店内,03-3251-7231,東京都
東京都,九段支店 ＡＴＭ,東京都千代田区九段南１-５-６,03-3261-1185,東京都
東京都,国立国会図書館 ＡＴＭ,東京都千代田区永田町１-１０-１,,東京都
東京都,東京営業部 ＡＴＭ,東京都千代田区丸の内２-７-２　ＪＰタワー１８階,03-6704-1111,東京都
東京都,ヨドバシＡｋｉｂａ ＡＴＭ,東京都千代田区神田花岡町１-１,,東京都
東京都,東京駅八重洲北口 ＡＴＭ,東京都千代田区丸の内１-９-１,,東京都
東京都,丸の内オアゾ ＡＴＭ,東京都千代田区丸の内１-６-４,,東京都
東京都,お茶の水聖橋 ＡＴＭ,東京都千代田区神田駿河台４丁目３番地,,東京都
東京都,麹町日テレ通り ＡＴＭ,東京都千代田区麹町３-４,,東京都
東京都,東京メトロ神保町駅東口 ＡＴＭ,東京都千代田区神田神保町２-２,,東京都
東京都,東京メトロ永田町駅 ＡＴＭ,東京都千代田区永田町１-１１-２８,,東京都
東京都,アトレ秋葉原 ＡＴＭ,東京都千代田区外神田１-１７-６　３階,,東京都
東京都,東京メトロ日比谷駅 ＡＴＭ,東京都千代田区有楽町１-５-１先,,東京都
東京都,東京メトロ有楽町駅 ＡＴＭ,東京都千代田区有楽町１-１１-１,,東京都
東京都,東京メトロ溜池山王駅 ＡＴＭ,東京都千代田区永田町２-１１-１,,東京都
東京都,秋葉原駅昭和通り口 ＡＴＭ,東京都千代田区神田和泉町１番地,,東京都
東京都,東京中央支店,東京都中央区日本橋一丁目４番１号日本橋支店内,03-3276-6611,東京都
東京都,日本橋支店,東京都中央区日本橋一丁目４番１号,03-3278-1281,東京都
東京都,室町支店,東京都中央区日本橋１-４-１日本橋一丁目三井ビルディング１９階,03-3279-4411,東京都
東京都,水天宮 ＡＴＭ,東京都中央区日本橋人形町１-１３-９,,東京都
東京都,築地 ＡＴＭ,東京都中央区築地３-７-２,,東京都
東京都,東京中央支店 ＡＴＭ,東京都中央区日本橋一丁目４番１号日本橋支店内,03-3276-6611,東京都
東京都,日本橋支店 ＡＴＭ,東京都中央区日本橋一丁目４番１号,03-3278-1281,東京都
東京都,室町支店 ＡＴＭ,東京都中央区日本橋１-４-１日本橋一丁目三井ビルディング１９階,03-3279-4411,東京都
東京都,新富一丁目 ＡＴＭ,東京都中央区新富１-１９-７,,東京都
東京都,銀座すずらん通り ＡＴＭ,東京都中央区銀座５-７-１９,,東京都
東京都,八重洲地下街メイン・アベニュー ＡＴＭ,東京都中央区八重洲２-１八重洲地下街北１,,東京都
東京都,コレド室町３地下１階 ＡＴＭ,東京都中央区日本橋室町１-５-５,,東京都
東京都,豊洲支店,東京都中央区日本橋１-４-１日本橋一丁目三井ビルディング１９階日本橋支店室町支店内,03-3534-9761,東京都
東京都,豊洲支店 ＡＴＭ,東京都中央区日本橋１-４-１日本橋一丁目三井ビルディング１９階日本橋支店室町支店内,03-3534-9761,東京都
東京都,都営地下鉄月島駅 ＡＴＭ,東京都中央区月島１-５-４,,東京都
東京都,茅場町駅前 ＡＴＭ,東京都中央区日本橋茅場町１-４-６木村實業第２ビル１階,,東京都
東京都,東京メトロ人形町駅 ＡＴＭ,東京都中央区日本橋人形町２-６-５,,東京都
東京都,コレド日本橋Ｂ１Ｆ ＡＴＭ,東京都中央区日本橋１-４-１,,東京都
東京都,コレド日本橋２Ｆ ＡＴＭ,東京都中央区日本橋１-４-１,,東京都
東京都,銀座インズ２ ＡＴＭ,東京都中央区銀座西２丁目２番地先　１階,,東京都
東京都,日本橋高島屋Ｓ．Ｃ． ＡＴＭ,東京都中央区日本橋２-５-１　１階,,東京都
東京都,赤坂支店,東京都港区新橋１-１６-４,03-3582-3271,東京都
東京都,麻布支店,東京都港区麻布十番１-１１-８,03-3584-0961,東京都
東京都,芝支店,東京都港区芝大門１-１４-６,03-3431-1121,東京都
東京都,新橋支店,東京都港区新橋１-１６-４,03-3595-2111,東京都
東京都,田町支店,東京都港区芝４-１３-２,03-3452-1711,東京都
東京都,虎ノ門支店,東京都港区新橋１-１６-４,03-3502-3751,東京都
東京都,東京ミッドタウン支店,東京都港区赤坂９-７-１,03-3746-1001,東京都
東京都,赤坂支店 ＡＴＭ,東京都港区新橋１-１６-４,03-3582-3271,東京都
東京都,麻布支店 ＡＴＭ,東京都港区麻布十番１-１１-８,03-3584-0961,東京都
東京都,神谷町 ＡＴＭ,東京都港区虎ノ門５-１２-１,,東京都
東京都,品川駅前 ＡＴＭ,東京都港区高輪３-２３-１８,,東京都
東京都,芝支店 ＡＴＭ,東京都港区芝大門１-１４-６,03-3431-1121,東京都
東京都,新橋支店 ＡＴＭ,東京都港区新橋１-１６-４,03-3595-2111,東京都
東京都,田町支店 ＡＴＭ,東京都港区芝４-１３-２,03-3452-1711,東京都
東京都,虎ノ門支店 ＡＴＭ,東京都港区新橋１-１６-４,03-3502-3751,東京都
東京都,新橋駅汐留口 ＡＴＭ,東京都港区新橋２-２１-１,,東京都
東京都,東京ミッドタウン支店 ＡＴＭ,東京都港区赤坂９-７-１,03-3746-1001,東京都
東京都,プラザ地下１階 ＡＴＭ,東京都港区赤坂９-７-４,,東京都
東京都,東京メトロ表参道駅 ＡＴＭ,東京都港区北青山３-６-１２,,東京都
東京都,ヴィルマルシェ青山店 ＡＴＭ,東京都港区北青山２-１３-５　青山サンクレストビル１Ｆ,,東京都
東京都,日比谷フォートタワー地下１階 ＡＴＭ,東京都港区西新橋１-１-１,,東京都
東京都,日比谷フォートタワー地下２階 ＡＴＭ,東京都港区西新橋１-１-１,,東京都
東京都,神楽坂支店,東京都新宿区神楽坂６-７０,03-3269-0161,東京都
東京都,新宿支店,東京都新宿区西新宿６-１２-１新都心営業部内,03-3356-3231,東京都
東京都,新都心営業部,東京都新宿区西新宿６-１２-１,03-5323-3351,東京都
東京都,早稲田支店,東京都新宿区西早稲田１-１６-４,03-3203-0131,東京都
東京都,曙橋 ＡＴＭ,東京都新宿区住吉町１-１４,,東京都
東京都,飯田橋駅前 ＡＴＭ,東京都新宿区神楽坂１-１２-１,,東京都
東京都,神楽坂支店 ＡＴＭ,東京都新宿区神楽坂６-７０,03-3269-0161,東京都
東京都,新宿支店 ＡＴＭ,東京都新宿区西新宿６-１２-１新都心営業部内,03-3356-3231,東京都
東京都,新都心営業部 ＡＴＭ,東京都新宿区西新宿６-１２-１,03-5323-3351,東京都
東京都,東京オペラシティ ＡＴＭ,東京都新宿区西新宿３-２０-２,,東京都
東京都,若松町 ＡＴＭ,東京都新宿区若松町２８-２１,,東京都
東京都,早稲田支店 ＡＴＭ,東京都新宿区西早稲田１-１６-４,03-3203-0131,東京都
東京都,早大正門前 ＡＴＭ,東京都新宿区早稲田鶴巻町５１７,,東京都
東京都,四谷 ＡＴＭ,東京都新宿区四谷４-３-２９,,東京都
東京都,新宿大ガード西 ＡＴＭ,東京都新宿区西新宿７-１-３,,東京都
東京都,新宿駅新南口 ＡＴＭ,東京都新宿区新宿４-１-４,,東京都
東京都,東京メトロ飯田橋駅中央口 ＡＴＭ,東京都新宿区神楽坂１-１３,,東京都
東京都,東京メトロ丸ノ内線新宿三丁目駅 ＡＴＭ,東京都新宿区新宿３-１４-１,,東京都
東京都,東京メトロ新宿駅東口 ＡＴＭ,東京都新宿区西新宿１丁目西口地下街１号,,東京都
東京都,東京メトロ高田馬場駅 ＡＴＭ,東京都新宿区高田馬場１-３５-２,,東京都
東京都,新宿サブナード３丁目広場 ＡＴＭ,東京都新宿区歌舞伎町１丁目サブナード１号地下１階,,東京都
東京都,セブンデイズプラザ新宿西口 ＡＴＭ,東京都新宿区西新宿１-１０-２　１１０ビル,,東京都
東京都,新宿三丁目駅前 ＡＴＭ,東京都新宿区新宿３-２-１,,東京都
東京都,本郷支店,東京都文京区本郷２-２７-２０,03-3812-1251,東京都
東京都,茗荷谷支店,東京都文京区小石川５-５-５,03-3944-2131,東京都
東京都,白山 ＡＴＭ,東京都文京区本駒込１-２-５,,東京都
東京都,本郷支店 ＡＴＭ,東京都文京区本郷２-２７-２０,03-3812-1251,東京都
東京都,茗荷谷支店 ＡＴＭ,東京都文京区小石川５-５-５,03-3944-2131,東京都
東京都,東京メトロ後楽園駅南口 ＡＴＭ,東京都文京区春日１-２-３,,東京都
東京都,秋葉原支店,東京都台東区上野５-２５-１１　上野支店内,03-3866-1171,東京都
東京都,浅草支店,東京都台東区駒形１-４-１８,03-3844-4181,東京都
東京都,上野支店,東京都台東区上野５-２５-１１,03-3831-1161,東京都
東京都,秋葉原支店 ＡＴＭ,東京都台東区上野５-２５-１１　上野支店内,03-3866-1171,東京都
東京都,浅草支店 ＡＴＭ,東京都台東区駒形１-４-１８,03-3844-4181,東京都
東京都,上野支店 ＡＴＭ,東京都台東区上野５-２５-１１,03-3831-1161,東京都
東京都,鴬谷 ＡＴＭ,東京都台東区根岸３-１-１９,,東京都
東京都,東武浅草駅前 ＡＴＭ,東京都台東区浅草１-３４-１０,,東京都
東京都,上野マルイＢ２ ＡＴＭ,東京都台東区上野６-１５-１,,東京都
東京都,浅草橋 ＡＴＭ,東京都台東区柳橋１丁目４-４,,東京都
東京都,本所支店,東京都墨田区江東橋二丁目１２番８号錦糸町支店内,03-3634-1191,東京都
東京都,錦糸町支店,東京都墨田区江東橋２-１２-８,03-3632-1211,東京都
東京都,本所支店 ＡＴＭ,東京都墨田区江東橋二丁目１２番８号錦糸町支店内,03-3634-1191,東京都
東京都,向島 ＡＴＭ,東京都墨田区東向島３-３９-１０,,東京都
東京都,錦糸町駅北口改札内 ＡＴＭ,東京都墨田区江東橋３-１４-５,,東京都
東京都,錦糸町支店 ＡＴＭ,東京都墨田区江東橋２-１２-８,03-3632-1211,東京都
東京都,東京スカイツリータウンソラマチ店 ＡＴＭ,東京都墨田区押上１-１-２　ウエストヤード１Ｆ,,東京都
東京都,錦糸町駅南口 ＡＴＭ,東京都墨田区江東橋３-１４-５,,東京都
東京都,亀戸支店,東京都江東区亀戸２-２７-７,03-3683-5511,東京都
東京都,東陽町出張所,東京都江東区東陽４-１-１３,03-3615-8211,東京都
東京都,亀戸支店 ＡＴＭ,東京都江東区亀戸２-２７-７,03-3683-5511,東京都
東京都,東陽町出張所 ＡＴＭ,東京都江東区東陽４-１-１３,03-3615-8211,東京都
東京都,りそな東京本社 ＡＴＭ,東京都江東区木場１-５-６５　深川ギャザリアＷ２棟２階,,東京都
東京都,東京メトロ門前仲町駅西口 ＡＴＭ,東京都江東区門前仲町１-４-８,,東京都
東京都,東京メトロ新木場駅 ＡＴＭ,東京都江東区新木場１-６,,東京都
東京都,豊洲 ＡＴＭ,東京都江東区豊洲３-３-３豊洲センタービル１Ｆ,,東京都
東京都,五反田支店,東京都品川区西五反田１-２３-９,03-3492-3957,東京都
東京都,品川支店,東京都品川区南品川５-６-６,03-3474-0511,東京都
東京都,目黒駅前支店,東京都品川区上大崎３-２-１,03-3443-6651,東京都
東京都,大井町駅前 ＡＴＭ,東京都品川区大井１-２-１６,,東京都
東京都,ゲートシティ大崎 ＡＴＭ,東京都品川区大崎１-１１-１,,東京都
東京都,五反田支店 ＡＴＭ,東京都品川区西五反田１-２３-９,03-3492-3957,東京都
東京都,小山 ＡＴＭ,東京都品川区小山３-２-９,,東京都
東京都,品川支店 ＡＴＭ,東京都品川区南品川５-６-６,03-3474-0511,東京都
東京都,目黒駅前支店 ＡＴＭ,東京都品川区上大崎３-２-１,03-3443-6651,東京都
東京都,八潮パークタウン ＡＴＭ,東京都品川区八潮５-５-３,,東京都
東京都,学芸大学駅前支店,東京都目黒区鷹番３-３-２０,03-3712-3131,東京都
東京都,中目黒支店,東京都目黒区上目黒３-２-３,03-3713-2111,東京都
東京都,大鳥 ＡＴＭ,東京都目黒区目黒２-１０-１１,,東京都
東京都,学芸大学駅前支店 ＡＴＭ,東京都目黒区鷹番３-３-２０,03-3712-3131,東京都
東京都,中目黒支店 ＡＴＭ,東京都目黒区上目黒３-２-３,03-3713-2111,東京都
東京都,大森支店,東京都大田区大森北１-３０-３,03-3763-3311,東京都
東京都,蒲田支店,東京都大田区西蒲田５-２７-１０,03-3731-0101,東京都
東京都,大森支店 ＡＴＭ,東京都大田区大森北１-３０-３,03-3763-3311,東京都
東京都,蒲田支店 ＡＴＭ,東京都大田区西蒲田５-２７-１０,03-3731-0101,東京都
東京都,雪ケ谷 ＡＴＭ,東京都大田区東雪谷２-８-８,,東京都
東京都,イトーヨーカドー大森店 ＡＴＭ,東京都大田区大森北２-１３-１,,東京都
東京都,羽田空港第３旅客ターミナル ＡＴＭ,東京都大田区羽田空港２-６-５　３階,,東京都
東京都,羽田空港国内線第１旅客ターミナル ＡＴＭ,東京都大田区羽田空港３-３-２　１階,,東京都
東京都,豪徳寺支店,東京都世田谷区豪徳寺１-２４-８,03-3420-6151,東京都
東京都,世田谷支店,東京都世田谷区三軒茶屋２-１１-２２サンタワーズセンタービル２階,03-3410-1231,東京都
東京都,祖師谷支店,東京都世田谷区祖師谷３-１-２１,03-3482-3121,東京都
東京都,等々力支店,東京都世田谷区等々力３-１２-５,03-3702-0181,東京都
東京都,梅丘 ＡＴＭ,東京都世田谷区梅丘１-２４-１１,,東京都
東京都,豪徳寺支店 ＡＴＭ,東京都世田谷区豪徳寺１-２４-８,03-3420-6151,東京都
東京都,成城学園駅前 ＡＴＭ,東京都世田谷区成城２-３４-１３,,東京都
東京都,世田谷支店 ＡＴＭ,東京都世田谷区三軒茶屋２-１１-２２サンタワーズセンタービル２階,03-3410-1231,東京都
東京都,祖師谷支店 ＡＴＭ,東京都世田谷区祖師谷３-１-２１,03-3482-3121,東京都
東京都,等々力支店 ＡＴＭ,東京都世田谷区等々力３-１２-５,03-3702-0181,東京都
東京都,渋谷支店,東京都渋谷区渋谷２-２０-１１,03-3498-3211,東京都
東京都,渋谷インフォスタワー ＡＴＭ,東京都渋谷区桜丘町２０-１,,東京都
東京都,渋谷支店 ＡＴＭ,東京都渋谷区渋谷２-２０-１１,03-3498-3211,東京都
東京都,代々木駅前 ＡＴＭ,東京都渋谷区代々木１-３８-４,,東京都
東京都,笹塚ショッピングモールＴＷＥＮＴＹＯＮＥ ＡＴＭ,東京都渋谷区笹塚１-４８-１４,,東京都
東京都,新井薬師出張所,東京都中野区新井５-２３-１０,03-3319-6681,東京都
東京都,中野支店,東京都中野区中野２-３０-４,03-3381-7266,東京都
東京都,新井薬師出張所 ＡＴＭ,東京都中野区新井５-２３-１０,03-3319-6681,東京都
東京都,中野支店 ＡＴＭ,東京都中野区中野２-３０-４,03-3381-7266,東京都
東京都,井荻支店,東京都杉並区下井草５-１８-１２,03-3394-6811,東京都
東京都,荻窪支店,東京都杉並区天沼３-５-４,03-3391-2281,東京都
東京都,高円寺支店,東京都杉並区高円寺北２-１１-７,03-3337-1141,東京都
東京都,井荻支店 ＡＴＭ,東京都杉並区下井草５-１８-１２,03-3394-6811,東京都
東京都,荻窪支店 ＡＴＭ,東京都杉並区天沼３-５-４,03-3391-2281,東京都
東京都,高円寺支店 ＡＴＭ,東京都杉並区高円寺北２-１１-７,03-3337-1141,東京都
東京都,西荻窪駅前 ＡＴＭ,東京都杉並区西荻北２-３-９,,東京都
東京都,浜田山 ＡＴＭ,東京都杉並区浜田山３-３０-３,,東京都
東京都,サミットストア成田東店 ＡＴＭ,東京都杉並区成田東１-３５-１２,,東京都
東京都,池袋支店,東京都豊島区南池袋１-２１-５,03-3987-3111,東京都
東京都,大塚出張所,東京都豊島区南大塚２-４１-３,03-3941-1195,東京都
東京都,目白出張所,東京都豊島区目白３-１３-９,03-3953-1271,東京都
東京都,池袋支店 ＡＴＭ,東京都豊島区南池袋１-２１-５,03-3987-3111,東京都
東京都,大塚出張所 ＡＴＭ,東京都豊島区南大塚２-４１-３,03-3941-1195,東京都
東京都,東武ホープセンター ＡＴＭ,東京都豊島区西池袋１-１-３０,,東京都
東京都,目白出張所 ＡＴＭ,東京都豊島区目白３-１３-９,03-3953-1271,東京都
東京都,池袋駅東口 ＡＴＭ,東京都豊島区東池袋１-６-４,,東京都
東京都,池袋駅南通路 ＡＴＭ,東京都豊島区南池袋１-２８-１,,東京都
東京都,東武池袋駅南口 ＡＴＭ,東京都豊島区西池袋１-１-２１,,東京都
東京都,東武百貨店池袋店 ＡＴＭ,東京都豊島区西池袋１-１-２５,,東京都
東京都,都営地下鉄巣鴨駅 ＡＴＭ,東京都豊島区巣鴨３-２７-７,,東京都
東京都,王子支店,東京都北区王子１-１６-１,03-3911-0131,東京都
東京都,王子支店 ＡＴＭ,東京都北区王子１-１６-１,03-3911-0131,東京都
東京都,尾久駅前 ＡＴＭ,東京都北区昭和町２-７-１,,東京都
東京都,東十条 ＡＴＭ,東京都北区東十条４-５-２５,,東京都
東京都,日暮里支店,東京都荒川区西日暮里２-２９-３,03-3891-5161,東京都
東京都,日暮里支店 ＡＴＭ,東京都荒川区西日暮里２-２９-３,03-3891-5161,東京都
東京都,南千住 ＡＴＭ,東京都荒川区南千住４-１-１,,東京都
東京都,新三河島駅前 ＡＴＭ,東京都荒川区西日暮里６-１-１１,,東京都
東京都,板橋支店,東京都板橋区板橋３-１-１,03-3962-1131,東京都
東京都,常盤台支店,東京都板橋区常盤台２-６-６,03-3960-6101,東京都
東京都,成増支店,東京都板橋区成増２-２１-６,03-3930-3181,東京都
東京都,板橋支店 ＡＴＭ,東京都板橋区板橋３-１-１,03-3962-1131,東京都
東京都,上板橋駅南口 ＡＴＭ,東京都板橋区上板橋２-３６-１１,,東京都
東京都,常盤台支店 ＡＴＭ,東京都板橋区常盤台２-６-６,03-3960-6101,東京都
東京都,成増支店 ＡＴＭ,東京都板橋区成増２-２１-６,03-3930-3181,東京都
東京都,石神井支店,東京都練馬区石神井町３-２５-１２,03-3996-0641,東京都
東京都,練馬支店,東京都練馬区豊玉北６-１-１０,03-3991-1136,東京都
東京都,大泉学園駅前 ＡＴＭ,東京都練馬区東大泉１-２９-７,,東京都
東京都,石神井支店 ＡＴＭ,東京都練馬区石神井町３-２５-１２,03-3996-0641,東京都
東京都,練馬支店 ＡＴＭ,東京都練馬区豊玉北６-１-１０,03-3991-1136,東京都
東京都,練馬中村橋 ＡＴＭ,東京都練馬区中村北４-３-２,,東京都
東京都,ヨークマート石神井店 ＡＴＭ,東京都練馬区下石神井１-２-８,,東京都
東京都,いなげやｉｎａ２１練馬東大泉店 ＡＴＭ,東京都練馬区東大泉６-４８-１,,東京都
東京都,千住支店,東京都足立区千住２-５５,03-3882-5111,東京都
東京都,竹ノ塚支店,東京都足立区竹の塚１-３９-１４-１０２,03-3884-0611,東京都
東京都,西新井支店,東京都足立区梅島２-３-１２,03-3887-7811,東京都
